Unique id,Customer Remarks
e69ae251-93d9-4c5b-96a3-7097daa6313c,Thankyou so much for understanding my problem..nd your communication is really impressive..u r such a sweet person.. thankyou ??
143daef6-20be-4718-9535-8b643cc179dd,Thank you for solve my queries and your polite support and nice to talk to you dear
69dde5d3-432e-4fe3-808d-c1e6beee2db8,Good person and his hear my problem and solved thanks 
16cab2a9-c2f1-4a9e-b71f-1dde39f17caa,I like executive support ever
c6b76556-45b7-4436-8131-4dbf47a6a422,This customer support executive Mr.  is an excellent professional executive. He is gentle and very polite and tried to understand my problem. Thanks to him for his efforts and he resolved my problem.
b7e79fce-374c-4af9-9c14-bbd3f99bf68f,Executive politely talking but issue cannot be resolved 
c68de54d-6451-416a-b2bf-55bb50bd6bf6,Nice to talk   
0e20afa8-2d6a-45eb-b44e-c1a1c38b0568,Very supportive customer service.
8c84d2c2-4299-4de7-806d-352c977cd09c,I m happy with customer support executive
8f6028bf-df74-4a14-8215-7d3eb2308fcb,Nice talk with customer care executive I am satisfied 
9015d984-ebf3-4fa7-83d1-a40e252cdb3b,Executive was very good 
19fa4b66-d8c1-46a2-8ea2-2a702901151c,"Customer care agent is very polite nature, but delivery agent is very unprofessional "
1b1de695-1c77-4045-9c34-2ae9b55286f7,Your seller is froud and don't deliver right product to costmers. This is failed for you and your platform. They don't deliver that they virtually display on your platform. This is big failure for Shopzilla. You have this type of seller. You lost millions of costmers trust for this type of issues.
b7d87ab6-9cba-466c-bc99-8f78715d7f7c,Good response by customer executive 
4f93d1c3-d65b-4445-b358-d2525120fc2e,"The customer service has noted grievances he assured me to help solve the issue.  I have booked a consignment of trunks with pockets as per the product but on delivery it was delivered without pockets . Sri. Abhishek has assured for replacement of the product. Hope this fine, I am a regular customer please help me in this regard. Thank you"
b17e5731-b66f-4251-bcbd-0d5c2fcf1659,"Make sure that sellers are sending correct items under the products categorised as \""no-returns\"". They can't always get away by sending wrong item, and the customer will have to pay the price every single time."
424bd183-4f19-40d5-9f40-db642e857e37,this is very best quelity of costumer talking
6109138e-dbfc-4555-be54-a84cb6bc8971,I trust Shopzilla before but now they Brock that trust by choosing the wrong seller because you guys I'm not able send perfect rakhi to my beloved brother on this rakshabandhan
fc616d80-42f1-42d6-9128-2b03f5605d62,CX care executive was good bt Shopzilla is not providing good services. It's taking very long time if this happens I will not going to purchase anything from Shopzilla.
0f73371e-8723-4d47-8f01-434a696d92bc,Thank you customer service
0b7e5075-b5a7-4859-81ec-d21218cae229,Your policy is seller friendly not buyer friendly .In no return product seller send any garbage  but no one to listen buyer problem.
09a5e8c5-e462-4563-99be-f56cd0b23918,Nice customer service
edecc0d7-c0c9-4cc1-97c0-1d3704a038fb,Bad service customer executive
d2967d86-448d-4d1d-92a3-2ef7a1d5fe51,I am very happy and very support Shopzilla executive my problam solve 
5c946dc1-fb92-4430-921d-267e0456a8de,Very good person lam happy with talking
200527ec-f63c-468e-adde-a4727cf18ddc,Customer executive talking good
8b4ebf6e-3fa5-4941-98b6-d4af112a5520,Good person
b6cf302a-3e95-407d-a5f6-49ec5ea0e330,YOU are a mess. **ing bastards selling used and fake products from unprofessional sellers and looting people with poor after sales support.
a2a5e5f9-faeb-4e52-8117-f680dd181650,"Best solution got agent's throw,just solve my problem quickly,plz"
63ebdcb6-b839-495e-9cde-58cebb7ce670,The customer care was good
2e08ba31-db77-45ce-8c40-c36f2b050b87,Awesome work by customer service
f95588f3-874e-4c1d-98a4-e4f22a140513,"good to help me, he addressed my query very well and also behaviour is very good. He know how to talk to people. I am happy with that help. Thanks . "
42b2ead7-9081-4c41-b788-9a61abbf2965,Poor & Pathetic customer service.... Not getting the correct status of my order.It has been out for delivery since 5days.
949ca72c-3061-428f-8dea-4987454d8eb5,Excelent reply from the executive
956c884a-d8c8-47e6-8620-40a49217c13c,Customer care was dumb.Didn't show any intention to help.
ef970b43-cd41-43ed-85f1-1bb9ba3f4119,"It was nice conversation with your customer support executive sakshi, I'm happy with her professional conversation, she has a good day"
3f7f0721-2f59-4c6d-acf2-fffca6909042,"I was nice talking to the customer support, she was very much polite."
b1378363-c082-40e7-bc35-7e83a91c28fc,The sellers should be black listed those sending the defective product to the costomer 
14494f2c-5c0b-405f-afec-904dbcc8af95,Good and supportive person.
d2f4e6fa-86e3-4651-a128-2494dbbda557,"Everything was good from the executive, but when my issue is not resolved then what's the use of this service, There is no flexibility in the services for return option, When there is mistake from your vendors who gave defective product and i am urgent requirement and the product is defective, how can a person wait for another 1 week to get the product. Terms need to be gentle regarding this when there is mistake from your vendors the policy need to modified "
4060e58d-dbeb-4ec8-9cc5-3a87a05da357,Sellers always send fake or duplicate product.... Please take action in this situation 
f8084069-648c-4649-a2d2-b9f152c6492e,Thanks for ved customer service support
2b5f0178-d0d7-46b1-a4be-10feb5d5c405,Delivery service and delivery guy behaviour is very bad and customer executives are also not supportable and cancel my order without informing me 
16f6d8e9-bcd9-4c37-b1d4-244a92ef5c9f,Best person and resolve my problem 
e6bff4df-5a39-4a6f-9c4f-3c191132b72c,The customer care executives are very helpful 
d6ada6fa-ce08-4499-bfa9-0a8776f27a6f,It's nice talk with you
5b4749db-529e-4558-9710-5d247432d653,Please make sure the sellers are shipping the accurate and genuine products as the defective or fake items being delivered is not acceptable. Its totally waste of money and time. We spend kn
8ff2b2da-e3a9-4d9b-8a04-3f0172c626cb,"The executive was okay, but the concern is it has already 1 month passed that I am trying to return this shit of cardboard but no resolution as of now. "
3b0a5322-c3f9-4d82-91fb-2b2f2f965a93,Good talking 
702dc32b-7353-4384-8852-0a8ad171f57a,Worst customer service 
e2161a62-ca9a-4d74-9adc-4520df936028,"Customer experience is good, you have to improve your delivery excecutive service, they cancelled order without talking and giving any reason to customers. "
957c945f-1723-46d0-a4cc-6390c12f9a89,Shopzilla customer care helpline very good responsible person all time ismy call pick up and concentration and discuss good performance support my call and help thank you so much Shopzilla
3df4f651-253f-4d66-84de-ada0363183ea,Nice talk I'm satisfied ?? tq
5b7a2ce3-8fd4-441d-a108-4b8ebfb6efc3,Disgusting customer service they provide same info available on app
3e67e784-a3bd-4f24-a174-fe228c699d10,Doesn't talk properly and doesn't even give information 
8444f822-a209-45a1-9833-88afeb1d5785,Excellent customer service 
a4debc43-a59b-4117-88eb-0bd68b370c91,Talk so good 
3e2d5917-f29d-4e51-858e-17198fc840fc,The Shopzilla agent said he will raise a complaint but did not do so
4fc76e26-a8fd-4c32-a1a1-1afc1f53ab15,Shopzilla customer care resolved my problem thanks you 
e8d33d21-3831-4044-87fc-941df2d1281d,"Last five years I am loyal customer Shopzilla I just get up many times many problems and many issues and I am also competing for the Shopzilla service. On the first time I get the best customer care support by  Shopzilla team my personal suggestion, she\u2019s You are Best employee forever"
dffd1df8-24b6-4067-8ebf-6baa6048cff4,Customer service best 
0b8c2e11-c62f-4003-ad00-2fc0e9613cc9,Thank you Shopzilla customer service
1e80a635-89e9-4128-93e8-5b949b02537a,The customer care support executive was very polite and she understood my query very well and she assured me that your problem will be resolved 
f87f5833-9eec-4a81-9f04-78b6ad08e066,Very nice person ??
8b34fd64-ebcb-4ef9-ab82-8186e8d24cd0,I PURCHASE 2  MEN SHIRTS BUT SIZE AND COLOR DIFFERENT. BUT THE POLICY IS  NON RETURNABLE .THIS IS SELLER MISTAKE BUT WHAT CAN I DO. NO BUDDY HELP ME 
acd5ca5c-b64a-4e32-b731-8a5881f04ba7,Please understand the value of any person's time. Provide the right product on the first delivery to any customer
ad9d457b-ac01-4095-96f1-650ba40cb609,VERY DIFFICULT TO GET IN TOUCH WITH CUSTOMER CARE WHEN THE DELIVERY GUY WAS MISBEHAVING
a941f3b7-8aec-44bd-a41f-8d478d8f3ee4,"As far as customer support is concerned, it's excellent but sellers like we are dealing currently is a matter of concern. "
e3016149-fa13-49a7-92a2-44590c06467e,This one executive has finally solved my problem
64881ed5-3260-4d28-9f10-13f68961872b,The customer executive was very nice and humble ??.. he resolved my issue within a few minutes.. His way of communication was very nice..He listened to my issue with full patience..I would like to wish him good luck for his future...and Shopzilla if don't mind i want to say that try to make him always ( customer Executive)happy always ??Bbyeeeee Thanks Shopzilla ??
53e998d3-2a5f-4bad-9c0d-6ea81c8e7987,"No issues, experience with the executive is absolutely perfect"
c71ae833-7b44-4602-900f-bda64f32666c,Good talk
b66f1537-ede1-470f-875c-aa77d6f148ee,Good talk 
98ab596b-aa95-4559-b1e2-ade1958fb72d,Do not onboard fake sellers & take responsibility of your business. I am at a loss of 4900 Rs shoe as it is a defective shoe & the return pick up was rejected
9678acf6-bed9-459a-9c1a-9146810a595e,He resolved my problem very politely. I'm satisfied with you customer care service 
0990ce4d-fc3b-45de-b310-f5dbe24b6178,Your Customer care is really a well and helpful. 
ffeafe0f-bfbd-4f6e-aa62-398e8d233f35,Nice talking to you ??????
0cb62905-765e-44d6-a3a2-1bc004d1cf37,Good person
cc2e88ed-83dc-48ee-9690-6f0d76d52994,Nice to talk to me
f9144bc3-60e2-49b1-a723-df1b38dab006,very good person 
48b83749-1494-4cbd-a7d6-abba0c0b4d8b,Nice to talk to u mam
99e2eeed-3270-4332-a19d-7d73971e9585,Senior executive disconnected my call 
c6270bc8-5217-412b-8ecc-d51e911bb5ae,Customer service was good 
c6a5d258-f42b-485e-bc10-f48dce1906ba,Pls remove the product from Shopzilla if the same is not available with seller
a89d7191-b50d-453a-bf88-07c50605294d,Strong action against sellers who are sending wrong products and then not picking up the product for return. 
6f23f058-7a8b-4c79-a57c-86ed7e575cff,Good talking behaviour 
15a47192-4f2b-430d-9f64-8b5cbbdbafbe,Good support by customer care person 
98d03f44-2f72-4260-a8ec-7b662efc3deb,Customer service is very good 
0c768e12-afeb-4af0-b783-7b43755630bd,Customer care executive gave me some hope to resolve the issue. Now team please resolve the issue asap
59d94bcd-d861-4599-a737-acbecfe2664c,CUSTOMER CARE VOICE IS UNCLEAR SOMETIMES. SO KINDLY IMPROVE THAT.ALL IS GOOD GOOD THANKS 
70c8f3a8-93f3-4f2e-89bb-51f16526c367,Nice talking
30abb340-be35-4d14-9089-bfccb5a0a852,I didn't quite catch your name. I think you must be new or something. I didn't follow your English because you were talking too tensed. Just relax and take a deep breath. You're doing a good job! ??
495a8a07-16dc-41e2-865d-1f8ed3705644,Shopzilla persons r rude n non sense Make peoples foolish
9f8ebbe3-4bea-4d8e-9bde-32d8556de776,It wasvery hard to reach you. When I mailed you twice you did not even repliedme and when I try to contact you through app it is always telling lines are busy and when tried to call you directky using customer care number it is either telling phone number is wrong or no executives are able to take my call. Worst customer care ever and the problem was with my pay later emi amount updation. I settled my dues with your lenting partner IDFC bank and they told me that they have got their full amount and no balance is pending and yet in your app the payment is not updated and you are sending me mail to settle the amount. Shame on your side. And because of that I cant order anything prepaid also
e4a35f1e-015f-43d2-bd3e-eb6c021136e5,Easy to reach customer service executive 
0497b62a-d0e6-4278-b4ec-882b60698321,good to talk with you 
4cf878c9-3542-40cc-9b36-d7a7d1877204,Was he sleeping while talking calls such a lazy person 
0d1ffd0d-3d77-4ca8-b39a-2b0f9ae57063,I think the executive was social and of good personality 
c1d71933-99ba-4d7e-bb06-451af1399d35,Very nice talk.
49e61af9-179a-4829-a44b-56d4a0520df7,Very bad shopping experience customer service not answering the exact reason for order delay and app charging me extra money to cancel the order both ways customer has to suffer never shopping again from Shopzilla 
85b17929-afc9-42e4-993d-05e7e5ba2060,Reaching out to support is very cumbersome. The chatbot don't resolve any issues that works based on key words only. Though in chats it is mentioned that u will Regards connect again if the call gets disconnected but same never happens.Further how can it be that the other mediums of communication with the customer care is wiped off. Only chatbot assistant is available.Really very sad to see the care of such a good org for the CUST O MER issue resolution. I felt being cheated this time.Regards
27cade6b-5347-410e-914e-142de7bca48f,Please improve your customer services make it easier for customer to contact to the team easily
812324a4-9471-48fe-8faf-36ccebc4fd12,"Kindly update the customers about their order timely. The exact issue about my order delivery is still unknown, even the customer care employees don't know what actually the problem is. What exactly could be the problem when the order is out for delivery!!??? Atleast give a proper and a clear reason for the delay of the order. And please make sure to contact the customer about such issues beforehand. The customer shouldn't be troubled to contact your team.I am still not satisfied with the reason explained by the customer care service. But whatsoever, kindly resolve my issue asap."
8cda6e0d-66fb-42e2-9444-189e1ce2ca30,Nice to talk with you 
12a2a1f5-3083-4555-9e10-e44ca8bb4c7f,"I had to call 3 customer care executives and they kept giving me excuses that their system is not working, they are having technical issues, one of them stopped talking and kept the phone on mute. Is this how Shopzilla treats their customers???? My problem is still unsolved and it\u2019s raising an anger feeling now. Totally disgusting behaviour"
a65db02d-7373-4ff2-a3de-d9f7287e9f45,Good quality then Shopzilla customer care
057d3101-ac9d-42e9-a460-a5824078382e,Nice to talk ??
75ff9426-8b92-4415-92c5-6e61a659ef83,She seems to be an optimistic person 
d49fb885-283a-42eb-8d83-93355ac2a25f,Very good conversation with this customer care Executive
acb69a12-5364-4024-86a0-8a9b664fed83,"she listen my problem very kindly, I appreciate her for her talking sense "
f675c948-8864-498c-93e9-b5e3f0bb2598,Good customer service Shopzilla 
de54d09d-4827-45ba-8e62-840148182373,Customer care support se baat karke achha   best behaviour for customerThank you so much..
e4e1b907-36f2-4451-8daf-d003fbde6df0,I love the way by which whom I talk speaks to me I love her. ??
74e32217-9fa9-4e0d-bd03-748dcda83ecd,"It would be great if, Shopzilla could make it convenient to contact the respective sellers regarding any issues faced by customers."
5387d0ba-d115-4d83-a92d-519a3fa9440e,"Very good Person,he try his best to resolve my problem "
83ca42a4-12a0-410a-8b15-86090d43f42f,I am really happy with the attitude of your customer service executive. Very patient and kind enough to resolve my problems ASAP
548afb9d-b7b7-457a-828a-be0e680ba4b2,Great customer service people
1a647b32-d3f8-49fa-bdde-f85b46950b6f,The seller was scamming with description of the product and executive was not able to help. PS - I have screenshot of the wrong description too
4402b0f4-97bb-4dac-aa5b-2a6ffacdfb8f,"I am very disappointed with Shopzilla. I ordered a Earbuds for my brother's birthday. But in my package items is missing. I told to the Customer executive about my issue and I need that refund   to buy my brother another gift. But they didn't help me, they even though didn't understand my issue. Please Shopzilla improve your customer service. This kind of service is not good for Shopzilla."
16831176-1f44-425c-ae87-7e5dd3f41da8,Good Supporting Customer Executive I Really Excited The Customer Executive Best Way To Solve My Issue...Good
9e7c728d-62d8-4003-b8a3-9b216b0eb9f6,The customer executive dealing is very good and responsive thnku
6995dccb-7498-4894-ab9a-6fb02795ab43,The customer service guy is so polite nicely talk and grateful minded????.. 
35cf94e6-4898-46ee-b41b-59bff0b0d038,Wrong product deliveredGive permission to customer care person to solve it.
058c2fed-77a6-4ed9-b423-2f69fb84657f,Nice person nd good performance thanks you sir but resolve my problem 
815d351d-327b-4f23-aecb-1ed77ed6bfe9,"Problem solved by Ms.  very efficiently and proffesionally, it was nice to talk with her and share the problem with her, she listens and resolves it very quickly Thanku   for your kind concern. "
7e1d4bba-c4ef-40ef-ad2f-b22ae2103924,"I didn't get the resolution but the way of talking of associate was very good, i think Shopzilla should hire more associates like her, she satisfied me on call....."
64530734-cfde-49f0-8bd4-05654d6bbf29,Worst customer service app! 2nd worst experience I have faced from Shopzilla. No executive is able give correct answer .. everyone gives false commitments and it nvr gets fulfilled
bedb82dc-3783-41e4-a2e2-dfde59490d96,Right now I talk to the person who solved my problem . He is such #1 best customer support man . A man with a golden heart Shopzilla have to treat him like he deserve 
53ccfdee-84e9-4def-97a5-fa4cc2244508,Nice talk
11ab994e-e7bb-436b-982c-b35d5f6ff328,Very poor service.how can the supplier decline my request when the item was not at all delivered? The delivery agent took back the item since it was damaged.
6e5fff9a-85a7-4f58-b3d1-170d07e0091b,Nice to talk with you executive.He solve my query
47c5bb41-fd1b-4637-bdab-c7885abc0cca,Good person 
e9f0dddd-8264-4c24-8171-b9f98cd3e75d,Best talk
7a09d744-c7be-4f90-a43b-0d389f09da20,Very awesome ?? person ??
e968553a-189e-40d0-a3ae-8e3923c1c10b,Please ease to connect Customer care this is very important 
538f398f-23ec-40e4-996c-48754950669d,"Rajat jee very good person, he replay my confidently regarding my issue. "
118bb32d-ad7b-4097-abbf-a49351f586b5,You are cheating with customer. Your market place sellers sell second hand device 
daaeb178-a187-4c0b-b6a9-ab46651fe44f,Nice to talk
f8c78bd0-55fd-4865-9b9a-bd7445ebd41d,Thank you Shopzilla customer care
d0499b7b-a119-410f-b368-a34dd05e65e4,Nice talking 
8c565955-c784-4090-b235-ac4a34310e5f,Best customer service 
f43734e4-e480-4546-a1a8-f4b95d8d9260,Appreciate patience of communication executive despite poor network connectivity and her tireless approach.??
4a15e74c-74f3-4854-969d-89e1710a2dff,On 24 AUGUST customer care executive said that pickup will done today or tomorrow but next day morning msg received that pickup was cancelled. This is horrible and disturbing. I took leave for pickup purpose but it's waste of my day and time 
f140b51c-64b0-4316-834a-1e5eae5e1fdf,"My issue is not yet reolved. I have explained my issue multiple times on email, and on chat and on multiple calls. I am being asked to repeat my issue again and again. My wife has also raised the issue on Twitter as well 2 days back but there is still no resolution yet. I am still waiting for my 1950 rs refund that I paid on request of delivery person to Shopzilla "
dd4e8c94-fc12-492e-b242-05e1ebf4354b,One of the best customer care agent I spoke. She was very helpful towards customer issue.Want to share the feedback to her.
ebdc60fe-ea31-4fdf-b940-47dc6172aaf6,This app has gradually turned into nonsense. It is so difficult to speak to a human customer executive. I tried tak l reaching out and the chatbot won't arrange a call with the representative. Utterly disappointed.
302a3d9e-6bf6-4654-a4c0-05926ce11440,Your customer executive left the chat without answering my questions 
8e22cfc0-4f9b-46ad-b692-1d5af9a56709,I purchased tv on 10 Aug but yet Not it's installed and no Shopzilla executive will help me for this.
bcced834-3e82-4cbd-a212-47667bac0605,Kindly make return option available as all the customers are not available to receive their orders so some other person received it and after open box delivery only the one can understand the problem with parcel who have ordered but not the person who has received. I've faced such problems twice as some other family member received my product and I was unable to return it after open box delivery. Kindly make flexible return policy.
ab65a5c6-23b8-4f9a-a816-8ac153686a5d,"Very Great Person And Respected Sir, my Asus Laptop related EMI quarry Is   ? Thanks Shopzilla "
09cc649d-5d99-42e0-9ecc-465a967099c3,Coustomer support executive behavior is very good & politely. 
301bab91-96d9-47c4-baae-cb3849769bfc,Your staff is doing great job i like the way he treated customer's.
8e8bc673-d59c-4b6d-9650-ea0c43ae1c68,Your customer executives are useless 
ce589735-d04b-4119-80fc-cd6769639777,Your Executive Answered Well
62963868-704e-4707-aa58-aac8835ee817,Staff not supportive
b1dc4512-357d-4589-aa4d-b11fcb0faad6,Best help customer sport executive 
26e890f0-d98c-4868-b22b-ae9e4e1636d2,Customer care executive not proper experience.
6778a490-ebbb-4595-83b7-14de39f92128,Unhappy due to non refundable policy that the product looks returned set by anyone before all liability goes to seller 
b8f9462c-6bcc-46a5-aa4b-4901638f151a,Very good customer service support 
fef5bbd7-1931-413c-af56-d7f5985f992c,Coustomer care agent was too good.
ecec1e49-fdf9-48a3-b289-23527eccd1a1,"Please bring negative score for your call executives From top brass to junior brass are incompetent, unskilled, ill mannered, illiterate, uneducated The best and funny part is everyone give the same response 24 hours mein apka problem solve ho jayega Almost 15 days now , is Shopzilla following lunar day (of moon) where 24 hour is 14 days? Because my issue is not getting resolved "
60cd3821-7882-4796-8c64-07387055df42,Please..give correct and correct product.. Don't harass people with broken products. You can get away with the broken damage product...but the person receiving the product faces a lot of inconvenience.
68f30e7f-e381-4aa1-86bc-0cb151b284b1,Style of talking was very attractive.
e0cbca83-879a-4442-86a1-6c7bebeda472,Customer executive was not supportive 
57728965-0633-4b0e-8e20-047de8de5814,I have recieved wrong model no one is deffending no one is solving my issue customer service center is not accepting Shopzilla exicutive is no solving my isue im very feed up 
f797380d-a0e1-4cc7-96f6-5f4293d6f061,Very helpful nd sweet person ??
858ab32f-177d-4ef2-8fab-5e741e359641,"I have booked calculator for my son looking at delivery within 1 day, which failed. Today being working day, I wanted product to be delivered after 5 pm. But executive was not able to help."
155a72b8-645c-47c3-97c7-cdb17955aac6,Best support for customer care 
1f369321-d6d4-42c3-aa93-b9e7a7a5ced8,The executive is illinformed. Puts on hold without informing the customer. Don't know the company policy.
d4d0c3f1-e7a2-41d4-b377-088b4c990f6e,"Wrong expectations setting why? If you can\u2019t do anything - at least have the gumption to say that instead of bullshitting and explaining that the survey is for the \u201Cquality\u201D of interaction with a customer service rep. If customer service rep can\u2019t do customer service, get AI to serve the same bullshit - at least they do it with more finesse.Learn a thing or two from SuperBuy - if they can\u2019t deliver - they are 80% correct, YOU GUYS ARE 100% CORRECT, ALBEIT IN SAYING THAT YOU CAN DELIVER AND YOU CAN\u2019T.Sasta na ho to koi Ghaas bhi na dale\u2026 Pathetic\u2026"
7dab70dc-7e7e-4507-af45-9cb693fcfb3e,i like to customer service
6b22ef89-ee71-4a15-8bf0-032324fde6b8,Good talking to me and very easy way solution 
44c931bf-5517-4d19-bcf4-695893f0beec,The customer care sir is very good nature he resolved all the problems so thank you so much 
cf94ae18-de28-45f5-a07b-70c22dbc1301,Executive is really very polite ??
f748b51a-4fbe-410c-94aa-c071e7caa301,I talk that person for Shopzilla is very nice talk good languageThanks 
2bdb5df2-510c-4b1e-9a62-2fe3920686e7,I am a busy guy and I don't like nagging on about my problems I just hope my problem is resolved quickly. The customer support agent was a great guy and I definitely feel much more hopeful about resolving my issue now
99e7ec44-3b62-45a5-9430-a66bdeab9239,Good person 
d916c4e6-0641-4193-b304-05bae695a931,Verify Wrong Seller
3c31a9d4-36cf-4865-b7b9-eb39cb161ac9,Then agent was good in a communication 
b5e3362b-7558-4207-81d8-96c6c683cbba,My issue not yet resolved and our customer service are advising me to contact the brand for resolution . Which is a senseless thing . How can a product will be damaged within 2 days of purchase from your Shopzilla . Meaning your are selling fake products to customers and robbing customers and promoting yourself as a  \u2019s number one E-commerce site .if your are not able to resolve customer issues then shut  everything. Don\u2019t blame customers for your hell  mistakes. 
f8a3f402-58ed-4f66-9648-36f1238c104b,"If you are unable to resolve the issue, why you call me? It's been a long time, about one month and issue has been not resolved yer. Customer care executive are unable to resolve my issue. They are only making excuses. Please don't call me in future."
cde85000-5d89-4d76-aa73-73239b67fbf4,I am not interested for this customer care call my problem is not solved and cracked conversation poor Quality for your customer calling experience 
