Unique id,Customer Remarks
3205034e-38b5-4afc-adb7-2736a63943a5,I am very disappointed with Shopzilla.The issue was not resolved.The customer care executive was polite enough though he was not able to resolve the issue.But I am appalled at the utter lack of responsibility and accountability of Shopzilla in providing tracking services.
5da0e227-ff4d-4ab5-9838-0aedd8feed2c,Very bad agent
2bdf6423-7744-4a3d-a4f2-a82dea562ddc,Good talk
1622eeae-67aa-466b-b9f8-c8c14f321f15,The way she talked with me is quite appropriate and nice as well. Shopzilla should hire these kind of executive for their customer support service.   bless you dear.
5acfc9ae-fa0d-4a24-a03e-bef0f5e8cd44,I selected for English language preference but it's goes into Hindi channel. But customer service executive doesn't understand English properly
aec2b3e7-64d4-4b7a-bcdc-bfbbabcdb29e,Worst Shopzilla customer service. Shopzilla shouldn't cancel order without ack from customer and also there's no compensation for customer satisfiaction. it makes us to move out from Shopzilla.
12d70594-6e46-4e2d-8fbb-9e2a8d349644,"Shopzilla customer service executive   was very helpful,I appreciate her to good future ahead in your company."
0e8cc4de-5fbe-49e5-8601-49e5197e7355,"Idiotic customer care executives, no solution from your end since April 28 th, call disconnected from the executive end"
ae91f703-9e80-4ada-b199-ef7f164335c9,"I ordered a sleeper which was delivered on 22nd july after that i didn't like its quality so i refunded the last date to pick up the product after refund was 25th july but my product didn't get picked up till 31st july.  And I was consoled to wait only 24 hours for 5 days after talking to the costumer care, even after that no one came for pickup, I felt very sad seeing the return policy of Shopzilla.  That's why I canceled myself last night, first time this happened to me ??"
e3d46e00-5cca-43c1-b8b7-8cb2ab3d2abd,poor customer service
095a9b11-9939-462d-b2cc-f5a023cfa4c7,Not at all happy with Shopzilla worst experience till date.   your customer representative said that phone exchange cannot be done due logistics issue and reason is not mentioned. If problem is from Shopzilla end then why end consumer has to bear consequences. Need to improve customer service and transparency in policies
979627b5-e0d6-4e23-8c60-7210b9b6e2b3,The executive was very polite and addressed all my concerns made sure to check-in and see if everything was resolved. It wasgood service. Thank you.
697e4978-65e9-4863-bb8a-48b4abdb948c,"Very helpful agent , the Team Managers should get more agent like her "
d4a9b9ac-1856-4906-9669-46a59d689cb3,While any issue we need to contact customer service it's be busy ..pls be in app itself to ....it's be very easy and comfortable 
4e9f58de-63c6-48b5-8e6d-fab64bc2419b,Not supportive customer care
64b1c8c3-bc60-410a-8747-1bf4f4a78fdb,Im happy with customer service...thanks
f01a1887-16eb-47c4-8129-7d7086df5c71,Best experience provided by Shopzilla customer service 
6500fe4f-1703-47a2-b70c-731acd4d63fc,"It was difficult to hear the staff , either the microphone was not efficiently working or there was a network issue ."
67338f0b-25af-40d2-a06c-7fbf256a0f34,I talk to Shopzilla staff before some time but they are very rude but when I talk this time to Shopzilla staff and she is very sweet and understanding and i love her nature thanku for being very kind and sweet.
d4533fcf-ea8e-4fc9-829c-a981ee489ef2,Customer support executive is very kind hearted 
17322385-fb98-4a0c-a5e7-1f6d481118d8,The customer service is very good 
4f562e81-ccfd-48fe-bb59-2e18a954b83b,Wen u assign a deliver partner for return make sure that the wishmaster agents shud du their responsibility...not instead of saying I m not capable of taking this item I can't take this return.....even ur app has flaws u shud specify tu an agent wat product he has tu tke frm custo.er cmng on door and seeing the product he says this is the trolley part I m hvng two wheeler...so u shud call customer care wat is this
462e49cc-9cdf-4031-a976-621e24de5ca5,Very nice person 
ee2fa123-5d27-4881-8353-2475ac0973d2,"Sellers with No return policy, are sending Incorrect products, incorrect size, poor quality products to customers. Please have a strict rule and sort out them and take action. "
820ef2cb-416e-4d0c-9253-c06d80a96f4d,"I like to talk with this guy , she was very humbleThankyou so much I appreciate ????"
afe566c9-b4ea-47f7-9803-f2f543939308,Nice person 
4aef04e0-d9e6-480c-aafa-9123072e4d11,"Please, do not do work with bad sellers, who send wrong items and fake products"
9fb89859-63a9-48df-bff8-d1c53e820dd0,I love his voice so preety please upgrade his post into manager in Shopzilla this person is very helpful thanks brother ????????
37cbb656-b9ad-4059-b752-b5d27f33eae3,very good person 
ddef5ed8-9af4-4d16-ab04-f337bbf56ee8,"Very wrost service nobody resolvoed without deliverying product delivery agent updating as product delivered it's absolutely wrong data leakaging without asking pin he has updated like this, what it shows? Till date am unable to connect with him also"
4219604b-af2f-4777-b06d-5d3f13af52fe,Executive was good and professional resolved my query but he was unable to address my doubt about FK services.but overall good ??
3cab58f6-0b52-4b0c-8027-2a372135f038,"Ordered on 27th with expected delivery on 29th. Put for delivery on 30th, no call, gets undeliveredDelivery agent confirms address on 31st but doesn't pick up call, marks undeliveredOn 1st, gets undelivered without a callOn the 2nd gets cancelledYour so called senior support agent   is absolutely horrible and even ridiculed by pronuncing my name at the end. This rating is for him and your service with it.Not only is your service pathetic, but so are your agents.Terrible service and experience I've had"
e2f43251-51ef-458e-a816-b0647c630925,I am happy with customer service
ecb32d25-c63e-4417-b649-77370b4dd303,Recently I talk to the customer support service your behaviour of your employee was soo polite and mannerful hats of to you man thanks for solving my problem stay blessed ??
9168fc6c-3e1f-40f2-8906-6d40ed713820,Front end support executives don't know what to do when we ask for solution 
e8ee6f9e-930a-4d97-8cb0-7fe1f5bee4d6,Nice customer service
692a9992-bb36-4898-96b7-d0ed18ed768a,This is disgusting....worst....not solve my problem....and customer support executive talk in unmanned way.....
96abb7c4-1308-42f6-9bfe-7ac742e58b55,Good Interaction with executive
774220b0-62a8-4e00-8a62-a46b9e822f88,When I order they show me delivery after 2 days and once I made full payment in advance they show me delivery after 4/5 days and today when I receive my order that delivery agent is not received call totally useless services I'll never order again from Shopzilla 
627698f6-57e7-4db7-be09-c9e4693e2f7f,Sir I have ordered two libas kurtas and wrong product send by seller in both the parcels . As per my complaint Only one parcel is showing for refund and I want my total money of two parcels .
c8cb8364-6da9-45c7-8433-4b78169220d2,Customer executive was polite and skillful but I'm really not very disappointed with Shopzilla sellers and their post delivery service.
1bb50b47-f8b2-43ab-b011-e1992b7898fd,"Nice to talk with you Miss  , After some Lil long conversation make me smile on my face with your resolution.Thank you. "
8254aac9-096e-4e85-b747-776b4701188b,Very good experience with this... She is very kindly talk with me thank you   ??
8966bc27-d21d-478d-b561-43f1171426ab,It is the duty of the customer care people to help the customers and they are doing their duty very well. Thank you Shopzilla for helping us. 
3467facb-7581-44ec-85c5-eb8119d3fb31,Customer care madam very good person.. she solve my issue ????
1d18740a-e23d-41ac-baf8-585a0231ba0e,Customer care services is very good
60c1e837-7cf8-46c7-9b1d-c0f42fbeccf8,If a delivery agent didnt contaceted customer and he himself says that customer rejected the product qnd cancelled the order placed without reaching customer is highly unethical and these delivery agent are giving false statment on customers. Shopzilla should make stronger policy to take care of these kind of issues that customer faces from delivery agent.
58f3c8ff-2e2d-4bfe-829c-db3495f5e1ec,Costomer care agents behaviour is so nice ??
357846b0-eedd-43b3-a948-303dd2491c6d,"Thanx for happing nice person,??"
0e7460d5-50e7-4c45-a85b-18e05720f397,My query was not solved but I knew the value of feedback how much Dsat gave the dent to an agent but I M not satisfied so take it as begging
499c4d9d-cf93-484c-981b-5a49172c5eca,Good to talk u
88a1b136-1fec-4b02-8364-37166f41e7bd,"CUSTOMER CARE AGENT VERY GOOD SERVICES,BUT Shopzilla COMPNY NO GOOD"
e0dd1e4d-6e78-4ce5-9afb-d00e8a54b7a0,"So happy to got a call from the customer service. The customer service boy understand my problem, help me to solve my problem. Thank you Shopzilla "
25a13ef5-5d2b-4764-8251-80ea44cd2528,Strong action should be taken against fraud delivery agents.
596c6274-11f6-43f1-97f5-6630298d757c,Customer  executive was giving wrong information to me
62e0082e-5ec7-440f-aa5c-3e25323170b9,My issue has not been resolved yet and I am facing so much trouble for the same. I don't know why the executive has disconnected the call in between the communication.
3183c0ac-e786-4514-8278-8bdac38aa78d,"customer care high authority is very good and polite ,solve my problem in a good and effective manner, provide me accurate information about my quaries"
36d1ed95-e3f2-4e71-a16a-32c3b951050f,The agent was polite and helpful..
6e376cc3-fca0-46f4-b8c6-bead0e4f09dc,"Sometimes i felt i am talking with some startup company, that has so many loopholes, Customer service people shows that they dont know anything and backend team is like a Govt Employee in some Govt Bank. I dont know how many times i have to call you guys for the same issue. Shopzilla future is very dark, better learn from SuperBuy or  , how to handle and fix the issue on time.   You "
431b2321-fcc8-49b4-9d1b-c9a6bbf4478c,"Ensure to enforce policies that panelize sellers who don't list their products properly, incorrect description or misleading images"
d0e2991d-2465-447f-9c1b-c1e51286e7dd,Thanks for slove my problem nd customer service also good 
8647478a-5255-4ebb-99f0-27c234ea6512,Happy with Shopzilla Shopzilla and customer service.
3cd1efa7-f19e-4a0f-8f9b-1da5b3c154f0,This is good person 
e8379c97-07e6-4bd3-ad40-3cb702a4a1d4,Nice talk customer agent
645ccb74-40f8-41d0-ac86-cab54b226dfe,Wrost customer care executive not interested to resolve query doing timeeeee passss only share this that executive.
3eb5611d-2652-46fb-8d63-c85ad6cdd3a2,I am tired of contacting customer service executives and not resolving the issue after contacting multiple times
6bcab5ce-c189-49d7-a308-8ed3690c0e5e,Polite person very nice to talking 
b77190e9-992d-49a0-97a2-d9ae7fbc3bb7,Bastard executive third class service by Shopzilla
c78c26cf-0909-4aba-beb9-8973e25b22b3,It's awful that half of the items from the order goes missing. Plus the effort to reach out to the customer support and delivery executive is just on another level... Never going to waste my time and money on Shopzilla again ever.The last lady was the o ky person amongst the last 3-4 calls that could atleast refund my money.
aa34502e-5cf8-46f3-8d33-ef9864cfbee4,Nothing to say Worthless services from seller point 
b54e2808-7d2d-4dec-bf77-220e963ca6e8,Thank you for customer care executive
4ffb94a4-8c56-4117-b2ba-44e319ef250f,My problem was not resolved.As per my assesment customer care has no power to resolve my issue. So i will file consumer case
b781e6eb-3468-4d7d-a7dd-fef5a2023cda,Customer care are very good. But problem is not solved yet.
57498bda-bd0d-4cfa-99c4-fed1cb6d640f,"Senior executive was not trying to help me out ,she only says casually that sir please wait ,but didn't proving any solution.she don't wanna listen any thing,she only thing same word that wait.very poor system of Shopzilla if they don't have capability to deliver order in a time so why they given assured delivery and anything earlier they cancel my one order from Shopzilla end and now it's second time that they doing same with me same procedure ...very pathetic system and very worst system "
7595939c-dd1e-466f-ab23-59dae3ec74eb,I am really happy to talk to her about my product problem 
5ab71852-04f3-4d84-b2a6-992e4d44ed1f,Thanku customer support executive ???? you solved my problem 
e60ea069-3ac9-4240-b7ef-aeb4e52c5100,"This feedback not to the executive but it's too Shopzilla, I have not ordered my order from SuperBuy because u guys were delivering one day prior to SuperBuy and now it's completely delay by 3 days. It's not acceptable, needs to understand few things we ordered to get on time due to some priority. After a long time I have ordered from Shopzilla but u guys disappointed completely. I m using SuperBuy only due to quality of service and they are very very far better then Shopzilla. "
c8e90b0b-2b93-4be8-a139-7c8473481f47,"Very good solution provide by staff, Good gesture keep it up "
8a52db0e-f8aa-40c1-9929-2d8961be31a2,"If not return, an exchange offer must be there for any order. And a verification and of the seller and quality check must be done before let them sell things. Many of us are having issues of getting wrong or less products on Shopzilla. It needs to be checked and those sellers who are sending wrong products to the customers, should be banned from here. People are loosing trust of Shopzilla. Do something about it we move on to something else. Thank you "
88f4752b-2eeb-4d51-8283-de36f6f3de92,I'm very disappointed for customer service... Nobody solved my problem ??
79036262-6d1b-4420-bcbb-5dd1850907fd,Good customer service 
c1ff9752-3878-49bd-97d1-5836745d07d9,Kindly take actions to delivery executives they mentioned wrong that i disagreed to recieve order. He cancelled my order by himself
cdba0867-d01a-421e-8c92-039b65761f65,Nice talking to u mansi
aca0cc96-cade-41ea-a226-0b3cc2b0e44d,Worst  seller recently experience from few recent orders 
4fcfe1ad-49b8-4b48-ae4a-076e77279d46,Good customer care service 
c52ba308-7845-4899-ac22-3bb4bacffb2a,Change your delivery agent who cancels orders at his own whim &fancyTrace the delivery boy whom I contacted on two days. He says he is definitely delivering but has the cheeks to cancel the order.Create a system for black dot on his performance.  The delivery agent needs to check for canceling the order. Make a system where cancelation can be done only by customer In case the delivery agent is doing he shbe able to do on an OTP from the customer It is 3 to 4 time this has happened to meFor their doings I have to go through the process of reordering.It is preposterous 
4747113a-2d39-4cc2-abd0-a3fc4a5c67c4,All executive are so sweet and very helpful
ac0db5bf-1f24-4471-a473-e4027a0407ed,Very nice effort by the executive.
d3aa6bbd-06ab-4e3f-8fc7-2155db3d1c48,"My problem are not solved but last time customer executive say please hold the call , but not fulfill my complain "
76656ed8-f9b5-4dde-8286-ea7e34cca4ff,Customer care representative was very very polite but our conversation couldn't get completed it's disconnected. I am much unhappy with product delivery and delivery boy attitude and taken 2350 rupees with words that I will have to give in office without payment they don't accept old mobile if you don't give I will cancel your product.
e5143800-e5b3-401b-a4b6-ec583741d581,Customer executive very polite & Resolved my issue 
7fcce7ef-fd87-485d-bd46-4aa6e63f45af,You're service is outstandingSorry to say but application me   fill hona chahiye ki aap ka product delivery hone k 24 hours me aap ki application me invoice download ka option aa jayega taki   dhoondhna na apde Me morning se dhoondh   hu ????Sorry don't mind customer service representative ne kaha uske baad pata   24 hour's me show hoga option 
1e9f65e8-aff7-4434-8018-0981484fe108,I have interacted with the most nice customer executive so far. It was a great experience with Shopzilla. Thank you.
75e9a0c5-9d0e-4f14-96a3-87e0c84a0e1c,Very good talking
fc091d2f-f422-4d36-8fd1-9b4f0846bc41,"I am very much disappointed, the behavior by Shopzilla.track record of a plus member doesn't matter.only matter policy. Only to mask up the fault of customer executive and delivery executive the customer is accused. It was already written in the complaint that the product was broken but only the word \""defective\"" is being highlighted. Basing on it til date the customer care is still misleading.if open Box doesn't allow replacement then why customer care approveokvereplacement re"
fa0b2f8a-34bc-4747-a642-e171f28f2299,This is the worst experience of talking to a customer support. He put my call on hold for nothing. I Hope it will improve in future.
c28f0c6c-ef6c-4203-b6bd-ccc48e7a3875,Good response from customer service 
347a7cc1-4b0f-408a-8ddc-ba7cd5e91cec,Shopzilla thank you so much customer service very good ?? information 
730f8672-2838-4ebb-af17-b9a40314b773,Good customer service excellent work but seller chatting with me
8fc40845-007d-4249-bbe4-2002362db7f8,Very humble person 
963f9d48-0534-44f2-b03a-1fd9a62a0241,The customer service associate was only reading the given script like a robot. He didn't used any skills to solve my problem. He also told me to cancel my order. 
dba03e1b-357b-4770-83e1-c077845eacb2,Shopzilla customer care support is very good and the executive understood with my problem and fix my issue and the reason my issue is bad quality product and defective and this 
841e34ab-b5ea-43be-adac-2e800142de90,Last time I talked a person who lovely manner and so friendly... Thank you sir
1aef276e-97da-4160-8b19-5b3eb52393d9,Not helpful Shopzilla customer careNot solved my problem.
3e7c6732-cc89-4c7c-aa56-6ae159e3b748,"I am writing this feedback with immense frustration and disappointment over the abysmal customer service experience I encountered while dealing with one of your agents. It is truly disheartening to see a company of your stature fail so miserably in resolving simple customer issues and providing basic information.Let me begin by stating that I had a rather straightforward inquiry regarding a recent purchase, but dealing with your agent has been nothing short of a nightmare. The agent I interacted with displayed a complete lack of knowledge and understanding of the issue at hand. It seemed as if they were either inadequately trained or simply uninterested in assisting me.Not only was the agent unable to provide any useful information, but their attitude was also dismissive and unprofessional. They showed no empathy towards my concerns and treated my problem as insignificant, which is deeply distressing as a loyal customer of Shopzilla.It is quite disconcerting that such incompetence exists within your customer service team, especially considering that customer support should be the backbone of any successful business. The lack of proper training and guidance is evident, and it reflects poorly on Shopzilla's commitment to customer satisfaction.Moreover, the agent's failure to resolve the issue only exacerbated my frustration. It is absurd that despite multiple attempts to seek assistance, I am still left in the dark without any resolution. I expected a much higher level of service from a reputed company like Shopzilla, and I feel utterly let down.This experience has not only wasted my time but also tarnished my perception of Shopzilla as a reliable e-commerce platform. It's clear that the company needs to invest significantly in improving its customer service processes and ensuring that its agents are adequately equipped to handle customer queries and issues effectively.I am seriously contemplating whether I should continue using Shopzilla for my future purchases, as this unpleasant experience has eroded my trust in your brand. I sincerely hope that this feedback will serve as a wake-up call for Shopzilla to take immediate action in rectifying its customer service shortcomings.In conclusion, I urge Shopzilla to address this matter urgently and implement measures to ensure that such appalling customer service is not repeated in the future. As a loyal customer, I deserve better treatment, and I hope Shopzilla can live up to the expectations it has set for itself."
92e550d8-17ca-4673-aabb-abf9b1f5f058,I believe that MR.   is more responsible and knowledgeable that the people I talked earlier including your senior staff.He deserves to be in the senior position than the person whom I have talked earlier(senior person).
99308bd4-e28b-40f7-9362-84cc1197aef6,One of the worst customer service! Sadly I have to give this comment! I asked for return and refund! But all supervisors also failed to answer my question! One supervisor wantedly heard my voice and ignored as she is unable to hear anything from my end! And hung up! Pls check it and take further actions 
b131ed7e-8e49-4131-992b-cfc7a1437480,Best customer care he talking wd me friendly and he solve my issue without any failure thnk u so much 
2434e901-af5b-4107-bacf-49918a12b004,Great customer care
5041d409-ca14-43ef-b5ea-dbf560877227,Stop talking like a robot to your customers and actually help them!!!
0cbfdbd8-6992-4f79-9625-6d9d9cd5bc98,"No, there is no problem. Nice to talk to the customer care service. Nice experience."
8cf849f1-b118-4440-bf86-0305220589ec,I really thank you for the support and resolution given by Shopzilla executive  . Appreciated his work of resolution.
2f250454-ec9f-47ea-9111-339b196b5c8d,The customer care person who talk with me he is so geniune and nice
238b512e-ea11-4822-817f-fa378f9426f4,Sweet person ??  thank you Shopzilla 
1fb4279d-73e9-4fc0-9cf0-911352af120f,"Nice work by your site sir,i hope you are a genius person, Shopzilla company have a good workers, thanks for my question slove "
45fc58a9-8b23-4bb5-8587-ad3751e31f1e,Customer care executive is very iresposible first of all take call and don't answer the call for 10 minutes and playing some irritating songs at the time of call after answer the call simpy ask customer is not audible am I mad who on line before 15 minutes for listen this am not audible I want to raise a complaint against the executive give me her details 
9f118c8e-ecfe-457d-9505-ad1e522a0e67,Mr.   was very understanding and knowledgeable person . He's very patient during our whole conversation and tried his best to solve. so Thank you so much for your time and efforts. Have a good day 
7fb83b13-b79b-4f39-8125-f7ecaf28851a,Very good customer care services 
2bfe3e7a-6bd2-454d-b7be-117f2165db95,Shopzilla is wasting our time to make us talk their uneducated customer care executives who don't know anything as well as they don't any action to resolve our queries just waste our time to putting call on long holds
ab3fc46f-cee8-47d3-9f17-95ad4c4f846b,Shopzilla customer service very very good thank you you Shopzilla 
41d43a81-2df5-440e-8eab-d47c73d6de55,Please tell the seller's to recheck the product before packing and to give open box delivery at doorstep.. it will save our time and effort.. thank you. 
fbddbfd2-e6c9-4023-99cc-f55a71058e10,Very helpful staff
ce355ff7-3081-4acb-b8fc-00cd86438b47,Awesome executive
484deff1-922d-482c-807e-3372075e3dcc,Very polite executive and was very helpful. My concern was addressed properly and it was resolved as well.
f127dd82-2ae9-4d6b-b654-ae2faac710db,Customer service was brilliant 
bc2318f0-f2b8-49b9-b2dd-aa452489b511,"Customer care talking good pickup bay very bad behaviour, he is missbehaving me "
879aa2e3-7059-4624-b85f-644ef50e99ad,Telugu customer service is not working 
64662dd3-c16a-41fc-a2c9-6696875f4c3b,I could not Share my Issues Job card to Shopzilla as customer care executive guided. Pl help 
64c2490f-fc6f-4e9e-a11d-e146cdaa12f7,this exicutive was good.. I always prefer to talk to some male agent apart from any female agent because they have less knowledge and they are so much talkative but this one was excillent
521065ab-723a-40fa-9e2a-3e61d014b592,Very bad service my product is cancelled by seller without my permission.And customer care tells my product will be delivered.They tells wrong information to me
ac82b9f4-cd84-488a-9582-a8ae041a2d8f,Good person 
798ba6d9-597b-40bd-8d74-1adfffeb9ddb,You talked me nice
329464b4-600f-4e46-9645-a3773ceaa2b0,I am satisfied with customer service 
4114ec8e-8a62-463f-aa58-ac2220b3eda4,"Customer service agent  was very polite and resolved the issue, Thank you!"
d973133e-e40b-4431-8871-67009175b285,Customer support executive we talk I think  he is good job for customer & reputation of Shopzilla company 
3489638e-b925-442c-ac0c-6e76e10be625,Quick response from the customer service agent. Good job
98e9506b-ae5e-47f4-bc1d-f35a421c4d0b,Avoid to board  seller who doesnt have return policy
527767be-3bb7-43fd-be57-6e1993bcd5d8,Shopzilla and shopping customer care is too good
4797258d-f593-4d0d-9615-a0acf0152ea3,All good customer service 
814f4147-7c21-4705-b884-0bbb57ef00de,Good work customer service is very very good 
c3f3907e-9b23-41f6-bada-0f19bc42ad2c,Order placed but seller can not delivered  my product and cancel my order Shopzilla not any action those seller not good for customer
6f53d16f-1a93-44c0-a7ae-c7c8887ffa24,See if customer support don't have the number of delivery agent means it's worst management I think so u should focus on that resolve the issue
80ead19c-6c32-4f51-a46d-4877b335c1aa,"I have been shopping in Shopzilla for the last 8 years but this type of problem has happened for the first time in which the customer care is also getting date on date only and no solution is being given. When the mobile pickup is done, this type of act does not suit a big company like Shopzilla. Feels like mental harassment."
bce79f2b-7449-4a05-8099-b01d1b963041,Mr.   care agent is phenomenal...He is very intelligent polite and honest employee.He handle this case in very smart manner and resolve it with his words   appreciated ??
