Unique id,Customer Remarks
570c42b3-a7e2-4f1e-a3c4-786627ecc05e,Nice talking with you...you gave valuable information to me.. Good response thank you 
57b7a319-223b-4c48-ad07-a065657e5617,Deal with fraud sellers
89d2381a-f89f-4fc5-9bfc-ad7662723b2e,"I received call from Shopzilla.Customer care executive asked me to share bank details, for scheduling technician visit.Why should I share my bank details, for scheduling technician visit.She canceled return request. Pathetic staff of Shopzilla I call again to reopen rejected request.But customer executive didn't open the same request."
b3c9f207-c58d-4a54-a8aa-f74fa9d1800a,"Add ""chat"" with an agent option along with the call option. There's only option for chat with a bot and then they either tell you to end chat or connect to a call. Sometimes it's not possible to call so I prefer chat more. But the agent I talked to on call was very efficient and nice."
8da38314-b42c-42c9-b532-a4d2de8b7dbc,Very good person 
0f4be658-4941-4eb5-887b-4e44176cb082,"Great customer executive, thanks to him"
90b6498e-fa48-4882-b436-e012eb52144e,No quantity assurance from Shopzilla.sellers are sending items without inspection causing wastage of time and peace of mind..
5ee13897-821d-4185-9e89-f41f78a43fb7,Customer agent way of talking is nice.
7c91f2d4-8c0e-4bfc-b2f1-2c2dfa971faf,"Pay a little attention to your sellers, how they harass the customers."
b27e8a15-5d9e-424a-8a16-ef41f105b6aa,"Your Shopzilla logistic person is not at all cooperative and coordinating with me even after requesting him for delivery. Product is already reached to my town since last 3 days. My Vapi town is a small town within 3 km radius, but still product is not reaching to me. I am literally bagging to delivery agent to deliver, but he is not responding. For your information,  I have cancelled my previous order due to delay in delivery. While writing this review finally delivery person came and I got my product delivered now. Thanks a lot."
1ee4691c-f4e5-4431-a08e-da1c4ca659ec,I wanted the continental speciale coffee as I have ordered for the but the delivery boy tried to deliver a different product. I insisted for the correct product. Then he cooly left the place.I spoke to customer care executive to arrange for delivery of the product since the price for the product has gone up.but he suggested for re ordering the product which I did not feel as correct 
1977feff-2594-47b2-9f29-e57d1f9c186e,Good person 
9a08f59b-3499-4e40-a244-e24cabf82ec5,good customer care support 
7e6fca05-69e1-4984-af66-91322b5d3916,Some time customer support eritete me but at last time customer support  talk me very goodly behavior it am happy to see him type of staaff are connected to Shopzilla it have outstanding communication skills Thankyou 
22c1904d-8ed7-449e-a47f-c2ad75c0aaed,Agent doesnt have updated information about delivery of product.
1b01d422-c7ef-48bb-add1-79714f11c265,Some sellers miss use the no return policy by sending different products
c828cbe3-4d8f-4ebb-a90a-7e3c9c1702bd,Gd person helpful 
3b70e74a-18a2-4b3a-bf86-d9677ae9e9c7,Good customer service 
89699d28-1fba-4738-ad9c-70b30d782a60,Very good person 
e32b7a26-d6a0-476c-8797-804b142d4906,Customer care executive don't want raised complaint against delivery partner logistics team.. compensation related or penalty related customer care executive didn't respond 
670438ab-011c-4458-bdd3-0f16cde4017d,An action needs to be taken against the seller for unfair cancellation of the order.
2c6056cc-bf1a-44d3-8d56-ee6b21364ba1,Customer service excellent 
8d90371b-79cd-4152-87f1-dae4a35706a6,Customer executive not good and communication and skills very bad behaviour.
79402190-2c33-4568-afcc-2498834456fb,Thank you customer service 
553f4dac-40de-4284-9033-bb22bc0b9f90,How the seller has canceled my exchange without contacting me.
76f8407b-2b32-4445-9ff5-d6b1a0be687a,Customer care executive very politely and understand my query and resolved it on time
d463e79a-44fe-4f6f-ae78-b85dfece71ec,Very worst customer service. Executive is not having minimal knowledge to address the issue. Got very careless & irresponsible response.
9b316aaf-8cd7-4106-8c59-5e449a12c422,I am happy with coustmer support agent.
3ac92925-52be-4cfd-a004-265481adc7cc,Good person 
aed8ff89-9c19-4967-a022-cb8a4ea34193,Executive was very polite in nature and communication was too good
3b4accac-7e37-4aa4-a601-9366ff073781,Bahut hi bakwas service koi fayda hi nhi hai in logo se baat kar ke in logo ke pass itna power hai ki ek delivery agent inko Inka aukat bata     aur ye bs sorry sir sorry sir   jate
d0698a1c-3df7-4a35-8705-c7bb84889e09,Shopzilla will be more helpful for customer care
138761f2-c406-4f4c-a715-e6a7bfb3079b,Customer care maam saport my query thanks customer care maam 
0fdf7352-240b-4da0-85c0-f55af41b8b50,The person didn't addressed my query at all....and labelled it as resolved....highly unprofessional and callous...didint ecen cared to call back
f751540f-5b80-4e88-846c-ff0b041aa88f,I am happy with the resolution.too gud agent 
378221c2-5d7a-4836-8e00-2b3ac36b5397,I m satisfied to talk with your executive....
7474748f-ae3b-44a9-9abd-d3d173649086,Executive was nice to solve query
01350650-ba7c-4fc4-bb48-8403d77c610e,Worst experience with customer care executive
ca9114be-f9f4-40cb-b81a-4ed840132be7,I am so happy from customer care executive behaviour 
4656a987-87fd-47b4-ab7a-d5288d0f3c1a,"Worst customer service, agent kept me in hold for long time and never replied back"
6a4b4bd5-72ab-44b8-967c-3ad0d6e44a72,Talking language superb 
b920c3c6-6aa9-4c70-984d-07b5ef40b8b5,"Why can you all have a customer care number, so we can call. It's disgusting that there is no phone no to call."
a5d35f12-0de6-46f8-a1c9-b4061d3b1565,Ok I am well . conversation e- cust executive was satisfactory 
772fb157-7409-4fed-b804-dd682f6fd721,Please control sellers so that they can't cheat and harass customers and logistics deptt  as well 
55254fdb-4c8d-49e2-aeec-e794607ace73,In Shopzilla system my mi 4 pro tv warrant expire in July 2024And Jeeves addition warranty expire there is no support Jeeves person loss is my I purchase 3year warrants after expire mi one year warrants Next time I no purchase any product to Shopzilla 
e4dcdd00-0b39-49fb-9166-6e953ecab5e2,My products was delivered by 14 August but agent of this area can't want to delivered my products I hardly request to Shopzilla that please give exact mobile number of agent who actually delivered the product to customers thank you
190cbbec-0b56-43cc-ad82-b0adf2094a40,**ing Irresponsible you are .All the seller are mother**er.All times happen with me. Last time in Jan. you **ed my 2 expensive mobiles and now **ing out of stok after waiting 4 days.#Scammer
b845aeb7-5acd-4b09-bede-657440a25912,it was nice talking to you thank you 
06b304b6-5a2e-43a7-9eeb-b04156c20154,I did not find Shopzilla in position to resolve the customer issue.   are cancelling order with wrong reason just to make more profit by increasing the product price (when customer buy the product with less price but seller first take order and later use to cancel product saying that delivery failed (wrong reason blaming customer they made delivery attempt but not delivered). Then increase the product price and force customer to reorder same product with higher price). Shopzilla always say they don have control and they can not do anything. If this is the case always and this is the solution. Then why customer care needed.
903bd16d-a946-4b2a-86a4-9fe49289eab0,"Now the executive who called with me, her voice was very charming, I liked the conversation with her"
6614b287-b824-454f-bd46-3999b35f19f6,Nice to talk with you 
03895fa4-38a4-4246-8801-958aad901031,Worst customer service from Shopzilla 
e73b16ee-ea14-4a6f-bad2-f9e3c8716931,The person was nice and was giving quick resolutions 
2e0eb78c-06d9-4ef1-92a9-d8c9fb6cf273,It was nice talking with your customer executive??
2826b491-1cf8-4652-b4b2-dad7c7203bfc,Nice Shopzilla talking to me 
2d4ffaf5-984b-4bbc-9715-d6ad236dfe96,Very very bad and very very poorCustomer executive issue solution one month above and 15 time Customer ececutive contract but my issue not resolve. 
0c64293b-a56d-4490-9221-98c598776b27,Open box delivery of my area bargarh-talsrigida don't ask for pincode even if it was mention but after I check it at home it was bad in condition so now the delivery boy don't take it bcz it is mention open box I cant return for the reason in the broken category. So immediately resign to that person of my area. Otherwise I cant buy on Shopzilla. 
41f254c4-7663-4352-b787-31c9d50c1be3,executive was polite did understand my exact concern and help me get resolution quickly much appreciated 
68bbe40d-50aa-40d5-a5b3-81c077587fae,Easy availability of customer care number would be a nice gesture 
04b87924-d5ce-4602-aa9b-ec402c33f25f,Customer service is very good. But kindly grocery items carefully delivered to the customers.
dabe4b28-b3b8-4c74-a3d3-40d0b054f8f5,"The customer executive   was helpful, sincere and well mannered. Good Job "
ead47bde-3028-4d23-ab31-aefb01ce527e,Customer care executive is not polite & no able to help the customer & he is ready lose the customer
859d65ba-8a55-437e-a4f5-1ef2b04e6ddc,should penalize the seller for sending wrong product
55411217-357e-4e46-9f13-95eedec76489,My Issue not solved even after contacting customer care.. 
8e09d995-99e6-4c7a-bc52-cdbf4295543f,I m satisfied the customer suporrt staff too good and well. 
1071e544-da3b-4b16-ae13-2cc05604f238,Those executive sitting at the centre resolved our problem and he was very polite and calm . He was with very good behaviour ??I like all the efforts which was put by him to help me regarding the order query.
3c654483-b8f9-4985-a4dd-240d0ae82b8e,good customer service
806d19e6-8eea-408a-857f-81c21c1ef9c4,"I ordered a new phone using exchange offer of old phone. Was given better exchange price than other sites and hence ordered on Shopzilla. On day of exchange, figured out what scam Shopzilla is using to sell their products.My old phone went through rigorous inspection by the delivery agent. He first damaged and removed my costly screen guard. Then checked phone every minute area. There was no issue and i was expecting this only as my phone was just a year old. Then to my surprise, he said my phone is bent out of no where. Was hard for me to accept this but he straight away said amount will be deducted for this defect of you want to still exchange for new phone.I have the video also on how he checked phone bent and will be escalating this.But ultimately I got same amount which other sites were giving. Shopzilla is just running a scam to boost sales. I am sure no one would have been able to get full exchange amount with the way their exchange policy is.Was completely fooled by them. "
fc988c34-16e1-4e35-a598-627e2418cce3,I really appreciate to   as a Shopzilla agent . It's a very kind that he help me a lot . So keep it up and ensure ur work as best ??
06313693-d76c-42e5-a108-9c7f82044fff,Still my order is pending delievery person u assigned yesterday was very much bad
2006441c-1571-4dc7-94e1-8069d30af0af,Nice talking 
710c021d-e8f3-4e3d-a93a-aded81d6ae9a,Nice customer care person I am very satisfied talk to him.Thanks dear
d2750da8-1eaa-4cb8-bd5c-5e30fef41b32,  ji nice talk me &nice person
1e85b4ba-ffe6-4e67-b8a7-0d5fd9a40718,Very good and expert customer support agent with very good skills 
28be3667-e7c2-4408-97b1-e4cf54727333,"I have spoken with two of your executives Aparna and Vivek. Both of them have listened to my concern and have given me proper answer and also have apologized for the inconvenience that has been caused. Although they don't need to apologize for that because it was not their fault. I just want Shopzilla to improve the delivery service from seller end. Rest the support executives are awesome. I wasn't able to rate Aparna because of my email was not updated, else she is also 10/10."
7720c398-701f-4c9c-a8d7-d3299a0ab756,Good person keep maintain.......
d34fcf50-c905-4f76-bd39-da6a55bede4b,The voice was echoing.. kindly take care of that.Otherwise the customer care executive was good in understanding and resolving the issue 
215f681f-c394-4723-aa5e-a9904aa3e1bc,Good communication skills I'm very happy for customer support executive. Very good communication skills and humble person.
54222e82-a9f3-4381-a79f-f2ea8b4fa5ec,Helpful person 
de232945-9c29-47f4-b3d5-17e42a27389e,It was very nice to talk to   he helped me a lot got a lot of information I got a product for refund replacement good information I hope to get information from him his behavior is good
42ef44e0-5d8d-4ae1-915b-f4d0a89dfaee,Customer care executive abruptly disconnected call and marked issue resolved by himself. Issue was not resolved at all. Unprofessional 
ba9bccc4-e930-4096-8765-f486978e8458,Nice to talk 
ca282858-61b6-41a9-bec1-6d1fdf9100c0,Nice talking with customer care thank you very helpful 
c9779d31-004d-4432-8598-a84a0f93f95f,Customer executive was so kind and helpful I fully satisfied thankyou so much...
cb0e7bad-0160-4bbe-aac8-c3071b40141d,My problem still not resolve also warranty was not provided by the company or seller so please blacklisted that company.
c62ad779-a5b3-45b0-b454-71aa789349c7,The customer support person was really polite and helpful. Thank you Shopzilla for always caring for your customers. 
fe3996e2-d8a8-4190-9b6d-74cf57337c3b,Coustomer service agent is so polite and helpful
56d8e1ee-279a-428c-b142-86e4b4c068d7,The person was very helpful
6ad874cb-6cee-4c3a-8ef9-070dd6938594,"Poor communication by the executive, He neither understood my query nor he want to listen my query. I am frausted by this type of services. Please Shopzilla improve you executive communication skills. "
d448da18-fefe-4ed3-8c16-9830c2b24de5,Good work agent
6bf8e168-908a-426e-9a27-3068a189d070,Making issue in 3 day ago but not resolved not provided product status update still waiting for updates but not any update product showing near my house like 10 or 15 km but not any delivery person take this order i am suprise because Shopzilla is big company and have not any delivery boy such warst conditions like this
b31c3aa2-ddc0-4149-b74c-32a7db75d708,Delivery agent should be more responsible should call the customer if he is not available at delivery address.
dfee57b5-8899-4b32-8ab2-5c3de13cc4b0,  was referred to solve the problem.in my washing machine. So far nobody  came and attended. The service person call and ask to send photos. Then he will not contact. Won't pick the call also.
8bf40a4f-a05e-4c73-a5a6-fc6bc6d588ef,Executive don't know about 'RVP seal tag'But pickup master is saying again and again that RVP seal tag is not available Should one RVP seal tag on its own House They didn't help me at all 
29e781cd-032f-410d-81a5-28af979c82c3,Very poor delivery condition by delivery agent on local area
e7d180bd-a1e3-4102-a42d-ef2e6b5368e2,Good customer service.
944eb092-615e-45d7-852a-c90767b92f1c,"Request to please trained packing staff of grocery to pack properly the number of items ordered and cross checked should be done also before final packing, many times grocery packing staff making mistakes while packing. "
909cf7bb-8afd-495e-bf4e-5b5ae22fbf84,Excellent customer service executive behaviour and service. Thank you 
8584c835-4b11-45c1-aa5f-c096f5b7a2ad,"I,m very happy to talk excellent job"
8e60552f-f1b2-490a-94a6-b7391d06c9a1,Nice way of talking Customer Support Executive And I want the same customer support executive to help us every time 
69765630-3195-43e1-b2b6-4dbbd8ba8fa8,Excellent customer care service 
416ab0c9-94dc-4bc7-8554-23c4ca6256b1,You guys fire your executives none of them solve issues :-( 
a00e9b87-7779-4364-8c5e-750252ab0d7a,"The voice of the executive was cracking and was difficult to follow, but after he had placed me on hold the voice was absolutely fine. Their is probably something wrong with your calling system. Please improve this."
f3a3d824-f83d-4eb7-8452-e2f4c3cf5d44,Very nice costomer service executive. He solved my issue 
6eb4fd4a-7e32-43a1-ac05-d98f8c67856e,Thanks for customer care 
a90060a1-2533-4c88-9a33-d0edf30a74a8,"Most of the time during ""call back"", ring simply continues without any executive coming on line. Sheer irritating and time waste exercise."
ce7e266f-36a3-4abb-a3f4-6a9f503a5f4d,"Hello, Shopzilla executive I ordered S size product, however every time - s size is perfect for me but this Sassafras gown - s size, sleeve was so long, so loose after wearing I get to knw, so I exchange this product with XS size - delivery man change the product and left, When I check the XS size it doesn't fit me well so tight, so I call delivery agent to take this product and return my S size product which I gave u today only He said - talk to customer executive, And the customer executive said - Sorry we can't do anything from here since item has already exchanged, if u want this same size S product then u need to place the fresh order since there is no option to change with same size as u already use that option, customer executive was so confused, I said to her - ma'am I just want to exchange my product with S size, which I had returned today with delivery person. I don't know what she understood, I hang up the phone. Shopzilla manager / Team- Plz let me know sometimes the product size is not okay as per the given chart in the Shopzilla website. Plz provide authorization to customer executive to deal with the delivery hub / delivery vendor. Literally it took nearly a month to get my exact size product, Try to understand - customer can't buy - 2 different size product at a time in order to check which one gonna fit? So we order right size according to chart, still face issue, thn we think might be one smaller size would be best for us, unfortunately it's too small for us then after testing, we want our original product back bcz we love the design of clothes, somehow there is no such option in Shopzilla website where I can exchange with same size, We return product in afternoon, but somehow came to know it's not fit, then the product which I had returned, I want that same product, Plz make comfortable to customer by placing option to return size, and also there is no connection between delivery man & customer So worst for customer satisfaction, Now to get same product, again I have to place order, it gonna take time of 6 day So HARASSMENT to Shopzilla customer with such big so called Shopzilla Brand - I'm the Shopzilla plus ?customer I'm the fan of Shopzilla quality products but plz do some changes as per thousands customer requirements U r running the business then keep ur website and ideas updated.. Hope u do understand, else call me "
62f7edcd-ee03-4703-abaa-bf8142a54f17,good job done by customer care.
a02032b6-df08-4542-94f1-d474159bc966,I am plus member of Shopzilla I was ordered one bycycle for my son Birthday gift and it was delivered before one day but the cycle handle not working due to Handel nut and threads problem. I have loss my commitment to my son I was not fullfill his Birthday gift I was replace the same order but it will deliver by 25th Aug23 my son also told why you ordered from Shopzilla so my suggestion is Before send the prodict seller must be final check the product and send to customer otherwise the material return / replacement back and  pickup again ordered unnecessary wastage of time really  I am not satisfy further one of my friend which I advised him to purchase from Shopzilla he also same problem and he was returned his orders.So plz look in to this matter and solve it
2878b0ee-b095-4b6c-9ba8-79d2204ae54d,Communication was grateful and kindness with customer supportive agent 
b9f03678-b735-4961-b6a1-8a3506291ed2,"Provide more control to customer care agent so that he/she can resolve the issues then and there itself, which will save time form both customer and Shopzilla. Thanks"
d1372236-b49a-4dce-be87-3278ecd5cabb,You're executive say me I have send service center number and address but till time not received I have call 2 time in Shopzilla but no massage received till time 
8417dd4c-ffe2-4e90-aea8-06d0ce58ad77,Vary good talking skill
202ce16c-e0d9-40fa-8c4d-01b6d0d546fe,These agents don't have much information. 
d541b6cf-3bf1-4aad-933e-464cf9fa4b66,"Add more language to talk. i.e., Gujarati.. Otherwise it's perfect."
0288e619-f1ed-4792-9149-23919de8fc2a,The customer care executive was very prompt and helpfuk #   
d3ee91f6-8c0f-490c-85f4-3669ffeff5f8,Very good and nice person ????
e3e46284-f48e-46ca-8f50-47917c0b697d,Customer care executive is very good. It has helped me a lot
56e4b8dd-863c-4280-9d01-512e410129ec,Very good person
f2f18f67-b616-4be0-b29c-ff4ae0420085,Please send the invoice with the grocery order as it's really hectic to find anything that's missingThe customer service executive was very helpfull and quickly gave me a resolution appreciate it good job ????
bfbf5fee-3b4a-41bf-8692-5a59e7ed44a6,MY PROBLEM SOLVED IN TIME IM HAPPY THANK YOU CUSTOMER CARE
632b875d-1ed4-4279-8f79-48b97d45feac,"Zero support , not even picking the return. No person came yet. Blackmailing the client.please help"
6bc8870b-0f89-47cc-8e31-7ba9ad05168f,Very good customer care
27ac05d2-8036-46cf-9457-d3bfe5619732,The person whom I spoke to understood my problem very well and removed the problem. Once again thanks to that mam whose voice was just like a cuckoo.
2707be44-a6a1-4f8b-a7ee-5536692f5567,Only False promises made by the cust care executive Arun. No one tried to reach me on call neither any actions taken. The DA was so rude with me still nothing has been done and finally my order got cancelled
8034a685-4b5c-41d1-bd62-5e021f61672e,Nice behaviour of calling person 
0f0f384e-9e3f-44f3-89f8-3e4a5d02bd7e,It was good to talk about my issue in late night.. thanks 
8bb56c03-97f3-416b-99bb-5e8523a02f73,Customer care supporting is good 
ec0b1f2c-c955-4ad1-8549-62996128d933,The customer support executive nicely helps me to resolve my issue. 
0a6e6353-5fef-4d92-a008-97e227eb03b3,Nice to talk you 
de4e7f37-116d-448b-a100-90f45e9c91b4,Sometimes no e-mails comes from your end regarding conversation. Sometimes many executives tell us to Waite for 2-3 days then it'll be resolved. But then no emails or updates. Even didn't receive mails for those conversation rating.
ecfc5f2b-c8a4-44fa-9f9c-998b82ad3656,Very good person 
fe38567a-19f4-4811-94b1-e8cc04b74db7,Item shows delivered in your website but your customer care tell that its not delivered according to their system. What kind of bulls**t is this.
61b28a83-c69e-4964-b281-d28fde65f8f9,"Nothing difference in contacting customer care because whatever information available in app they are providing the same, so as human being I need some more information again from a human being. That's it. "
79ef46af-0b57-485a-84f3-3c851507c3db,I was talking to mam she listens to my problem very well and said that I raise a ticket and as soon as your problem will be solved 
e7f2f4a4-72e8-4946-8f2c-070fce61d9ee,Good work done by executive.
e2f8790e-7668-4395-8d21-d8038f393347,"Negative feedback to Shopzilla, and the seller even "
6b688f82-9c57-4c2b-b945-5059b48fb819,"Great manners for customer executive.. but policy are very bad ... Shopzilla offered me   protection plan that is very worst,"
0890ad7e-f955-440c-8fa0-4d2c2e769272,Communication with agent is good. Hope for the resolution now. 
2a2deb21-39d7-4418-8d8d-471f3c70331a,I had a simple ask of updating my Billing address and all I could hear from executive was some rehearsed answers.
c155f957-3315-4cbb-aa71-1c98a604f390,Very good your talking 
6e968563-74e7-4e94-be16-cbdd9a6dccd1,Customer care is solved my problem and very well explained
708abde5-cebf-4831-9a53-79de42d9b77f,Very good customer care experience 
3dea1417-c9ab-4b85-a3c3-7271be5ae957,I have ordered moto edge 40 22 July 2023 my concern this product was defective rear camera I was return this phone at same day delivery but my return request was rejected my problem not solved customer service executive.its provide wrong information today date 16 aug 23 but my problem was not solved my phone not replacement.plz help me
aa172949-953b-4709-96b1-22ae295adc1c,Interaction in telephonically is good experience she talk very nyc n solve my problem thanx dear
94e7f63e-2e1e-46ed-972d-2648b55a21ad,The executive I talked was very helpful 
42071ec4-e003-4bce-81af-6b8e0b2a19fc,Your customer care executive issue resolved short time great work.
1c8b3866-d464-411f-b0c8-682534c5c78d,"Helpfully,and supportive agent"
729e8d41-ebb0-4eaa-ac20-82a23d866302,The support agent was very helpful 
39a450c7-7945-4fad-a767-3e37cb77dfbc,"Thanks for smooth cooperation, specially customer support executive  , she is very nice lady, I'm happy with her behaviour "
fef367fd-5b2f-4d28-9a77-7a691979fe38,Very nice Shopzilla customer service
51307c5d-3f70-471a-a490-039ecfbc2008,Very good talking with friendly behavior. 
8384e481-4957-4971-a89b-11ed1ad2584a,Very polite and helpful executive. 
f53bc08f-db5a-49bf-923e-1063cfacb726,"after listening my issues the executive won\u2019t able to listen my voice mor then 3 time, same happens every time, how and why ?"
0672da00-0496-452c-9913-b40e5588db91,Last conversation with your Shopzilla senior executive was very impressive with respect to knowledge and dealing with customer. Really I appreciated and thanks maam...
27b48fb5-dda7-42b7-b7f7-58c65ed06852,Your customer executive not resolved my problem 
3edd2585-3b59-4293-89ec-67a6c5bddb86,My packet is missing and Shopzilla customer care has no ans for this. Very poor service. 
b569cb00-021d-4d0a-96d7-a11d377dc874,It's very difficult to reach the customer care.
9ac582b8-6862-4a5d-8816-d8d36a0d1258,Nice support Customer support executive Shopzilla 
