Unique id,Customer Remarks
cb278698-7c1d-4712-a8d3-7da47b8a175e,Good response from customer care executive
2242de40-a845-42aa-b048-767f29e2837d,It was a great experiance while talking to customer service . He helped me with all my issues . Thank you so much
6085dcdc-877a-4781-8a8a-5dcc776fc78e,Nice talk you Please my problem solved
7d76e648-c21f-4f30-9ec9-e0046d0bb4a2,"seller didnt aproved my return request yet a day ago,   otherwise executives are so dedicative, thank you"
659cdd9f-fae4-4855-968f-af16d772f0f1,"I placed the order gift card order worth 20k on 5th August and the order is still pending, and your customer support executive gave me the wrong information that my refund will be processed within 24 hours and it\u2019s been more than 3 days, worst customer support ever"
df321128-e6dc-40e6-bfcb-8083df9d8df5,"Customer is not happy with delay in delivery and wants to cancel, executive not cancelling..worst policy.worst delivery. Pl cancel and initiate refund."
ee409dad-5027-4dba-9b0a-a1af5ceda14f,Good feedback for this customer care 
56242fb6-56a9-4421-ac72-1067938f3c1f,"The connection between Shopzilla and Shopzilla is nil. Even a small logistics company has proper tracking mechanism and complaint answering mechanism. If something is delivered through Shopzilla, Shopzilla doesn't have any contact details. For open box delivery someone should be there at that place and Shopzilla doesn't promise any date or time of delivery. So if we order something, we should avoid all personal task and wait for that parcel and the worst part is, it gets delayed further again.Please have little responsibility atleast "
f599d2e7-2c76-40c8-a9ac-e3e84c9e62bc,Very bad customer service 
50caca3b-872e-4102-abe4-d63bde4f7b43,Very poor customer service
7b32316a-833b-4a8d-ad33-c4009919f366,your process wastes everyone's time. How come you expect a customer to upload the image of the product that we didn't accept. Please check with delivery person.
d972b40a-47bd-4a90-b8df-e6634b054d40,I have problem related order at 10 pm and your customer care person helped me at 10 pm and talk with great respect thanks for your help and support. Excellent service keep it up ??
b98e3f90-8d39-4ccb-8602-7bf7c985f46d,"Return request is accepted( 3 times in my case) but then seller cancels request- as as per seller it was open box delivery but in fact the wishmaster didn't inform me about OBD. I have video proof of that as well call recording. Gave all information to customer care executive so twice my return request was initiated but cancelled again. I have g9t used, damaged, old product which may have been manufactured 5-10 yrs back, as there is no tag. This is not expected from Shopzilla ( most trusted and reputed online shopping website)."
05844d9b-c46e-4f28-8e6a-a007281a4fb2,I would like to know action. My complaint was delivery executive brought the groceries in open box. When I checked he was rude and challenged that I will not get any more Shopzilla deliveries.
5b3a9dfe-8c26-4c5f-9824-02db5daf7ecb,Super customer care
385a2f2b-4bc4-49f6-9ac3-fc1c243f014b,Why Other Language is not option in customer care call...
7e2975cf-4ab8-4bee-b294-a62ae678666d,Very hard to reach the customer service executive. 
944db43e-fe3a-4460-aa46-72358875d02c,Good seller not available in the app
7c665c37-1bfa-4c5e-969d-fc6179732798,It was very nice to talk to the customer care agent but my delivery problem was not solved 
794da6db-6759-463f-ab5c-741a6dafeee2,Good communication with customer care 
c52ef94e-f8f0-4a5e-af6b-0d936765ff5d,Customer care   bahut acche se bat kiye I am happy 
dc8f4717-dad1-4a1b-8797-dd84f31b14aa,Very good customer care  support 
2a4cadc1-1eec-4d4f-ad7a-46ad961db298,I like the way of talking very much......and her way of understanding  my problem was really nice.....i have experienced a very good time with her...
4af1ae8d-d446-4c41-bdaf-f98cee5e878a,"In my order it's shown that OPD facility is there, but executive told me in his system shown OPD facility is not available. How it's possible? When I have ordered the product, it's shown about OPD facility, even if I would reorder it then its also showing about OPD facility. Then how could he denied that OPD it's not available. Totally disappointed with him. "
24fa199b-00c1-44f2-acdc-ff79c6db5985,It was very good experience with the executive of Shopzilla. His way to communicate was too polite.
0195f387-5c81-4e96-984a-6b16577ed89b,Best customer service experience
5dadfd2d-9240-46c0-b5e3-7d43a3c0e065,Nice talk
99657d35-0f67-4aea-a5d4-4bad1349dddc,Some diturbance on background came but executive is very understanding so problem resolved please try to improve network
78d599dd-c79d-4c1e-9522-47ee89dc8642,Good customer service 
2b38fd15-9daa-4353-bbec-c8b5d60109cb,Great support by executive 
9d115fa1-4789-4a39-a9e5-a1ab0a56f01f,Agent is very patient to solve the problem and I appreciate her work. Thank you 
9bc54918-7bfb-4f67-80b2-d972a83cd10f,I lik the customer service 
25fd3522-66ca-44e1-9e77-b939033e0c87,Most of the time call get disconnected by Shopzilla executive and they do not bother to call after they intentionally disconnect the call
b68b479f-08af-497d-ada7-48171e100b12,"She is very helpful,sweet nd kind person. Thank you ????"
e4925f2d-3ee0-4869-9551-d6c6f2a772b8,Customer support executive was quick precise and solved my issue quickly thank you once again
440e1c3c-7ab3-4d8a-a690-6757d8ac0334,Nice customer service 
ba422e3e-83d3-4fcf-9cf7-9dde4478b27b,Great behaviour of customer support executive 
25d67c17-1e09-4017-928a-b87ce0f7485b,Present Support executive help but according previous response was very dissatisfied to resolve solution
34fd21eb-6aca-42fa-ab3d-02874058870f,Policy is like supreme court order. If seller is sending bad quality of product. Shopzilla must take action on them. But here customer have to bear loss. 
e95530cc-03e1-413b-9225-c4de242b5974,"My experience with executive was very pleasent and fruitful,from my end nothing more required to change,good"
47aa1f24-fdc8-41d2-be17-d5bca2ea4b51,"I placed the order gift card order worth 20k on 5th August and the order is still pending, and your customer support executive gave me the wrong information that my refund will be processed within 24 hours and it\u2019s been more than 3 days, worst customer support ever"
3ab3c675-e131-4aa7-9aea-1be70c8a4e45,The product which I received is wrong from which I ordered and placed order for refund   told item will be picked up on 11 August but yet know one came to pickup the item and I contacted customer support they told that you have mentioned wrong information about the product return please can the return request and again place fresh return request now I am waiting for the same nd also else before your customer service executive told it will be picked up this the case what should customer do
d2c3bca6-252f-4093-897d-bd1e1840da2f,Thanks customer care 
a3895247-7886-46b8-b7d6-542faf29a1e1,"Good Experience, executive are helpfull "
d28f27f1-7d13-48ea-92f7-9815d9de020c,Executive is excellent 
7ef9de14-5310-4919-a366-ec609df2fa26,Very good person 
38485ad1-881d-4183-bfb4-03937eacede9,Very good behaviour of personnel 
a3559521-34c0-4593-b727-be873535734d,The customer executive actually helps me in an effective manner.
9244e382-acd5-4573-bb47-00fb2f0e08aa,"Had wonderful quarry with executive, said issue will be resolved. Good. "
4ff87176-3c1a-4e1b-8083-8a762bd6ad55,Excellent customer service 
00241e33-6c1b-41a2-9f3a-ff32900cd4b0,"u have a very poor performance regarding reaching the needs of customer, the worst experience of my life. Even the customer executive have poor etiquette and no prior information for customer to inform them I will make sure people who I know will never shop from Shopzilla "
41bd980a-e781-47db-9177-c74a5c4d4147,Talking with happy 
539aa69b-c7ab-44e8-a8a8-f30ef8f06ab1,As per customer support experience i am really very very happy that Shopzilla service person are very helpful to resolve customer issue. Thank you Shopzilla
5c06e71c-10e8-40a9-bee3-5489abc6d7d8,It was first time for me to talk to a  issue solver CCE. I am so happy.
b9fc28bc-6a7b-4d89-ae39-47ceddd6fabb,"The Customer Care Executive was very professional, with sound knowledge of the product,services and policies. She understood my query in one go and provided the required solution. I really appreciate her time & effort, and thanks to Shopzilla to have such amazing people in their team."
869bc32c-75a9-4c6a-98c9-cc62ca407678,Why soft copy of invoice is not being made available in the app itself?? I am unable to find it. The customer support Executive told it has been mailed to my registered email address but haven't received it yet!! 
0866b017-441d-4e39-a238-23813dde8a40,"I tried to contact customer support for the same query for at least 6-7 times. Nobody is able to give proper information and resolve my issue. Such a worse experience. Lack of knowledge and fake assurance was given by support staff. On my last phone call she assured me to provide customer care number on text message and as I said everything is about fake assurance. I didn\u2019t get the number and proper service as well. Overall very bad, inconvenient and worse experience ever by customer support."
9d551f65-74c5-4170-849b-e75969bc209c,"I want add pin code in my billing address so that i can claim the bill in my office, but it was fairly rejected by customer care. Please help me out"
da73779e-f03d-43f9-97fe-59c3d2366990,Thank you so much for help Polite talking good work and talking  so good ???????? i am very happy 
716a422f-f02c-4932-8fb0-d662bdb58366,Please try to make delivery faster specially in RURAL areas. Because it is too slow and not every-time a person is available to pickup the products.
6b92b6e9-e8aa-4eea-a56b-4131241cbcd4,"I want to change my International number in my profile which I wrongly put while creating profile but agent couldn't able help to change,I am unable to receive any OTP message in my mobile.I want to change my mobile number to "
fafa332a-1216-4e59-acbc-dfb05022632b,The product delivered is defective and it cannot be returned/replaced even after talking to the customer executive.
a8d6c5ba-aa99-4184-939d-773482f3a40d,"I am not received the order that makes me to contact your customer care,so I would like to say please try to avoid such cases..."
10f43085-9e01-425d-afdd-4639efe28eef,Good person
dd8ed820-d3d3-4c75-b74a-aada065ac72d,Very good person when I talk him. And he will fully help me. 
9e942208-b483-4340-a48d-23c910209c69,Issue solve by customer care thank you Shopzilla 
dbd5b478-6e1e-40c5-bb68-96d2bfb3114f,I am so happy to talk with Ma'am thank you costmor support 
cc36cd4a-f0f7-48c5-ac50-4b30f8815949,Customer care service is good but delivery system is getting slow and irresponsible.. so very bad... 
0f57264e-cf84-4108-9b00-11c4686a5629,Agent was good in responding with information and good amount of knowledge but the platform the seller the policies is pathetic not at all happy with Shopzilla and service. Agent is not at fault but the platform is. 
b2b1ed01-b012-4036-a0ab-438ae03d75ee,Thanks and thank you for reaching out to me Customer services are good for me everytime when there is problem it reached out and I would like to thank you all for the good services 
38cdfa93-e129-4846-953c-88f0ed233e69,"Stop your plus membership because that is of no use. You did not even bother about your own timelines. What is one day delivery according to you??? Your delivery partner is also pathetic. You and your delivery partner both do not care about the customer. I called him 20 times to know where is my order and he didn\u2019t pick. Moreover, I got the message that I was not contactable therefore, delivery was failed. How ridiculous is that. I called Shopzilla customer care and was promised that product will come today but nothing like this happened. Again false promise!! This was not expected from Shopzilla. Till now your app shows it will be delivered by 9. Dude!!! Its 9:46 pm. At least remove this basic bug and if you need any help in that please call me\u2026I will help you out!!! May God give you the ability and positive mind to serve your customers better. Customers who should be your top priority are at first number but from bottom!! Think n respond!!!"
11aca2da-2bff-4d23-9308-0c64492592ce,Mind blowing customer service...very nice communication
80916bf5-ddc4-460d-9674-2fb6e5b50b3f,Very nice talk to you
b1188c3e-8ef6-40b7-9811-decb3d3163e0,Good job customer service 
5fc6cc22-c7b3-4655-b3b0-703ad1b1b63b,Agent is so awesome and man happy with the call 
34cfcad6-3d7d-4093-a123-4b8560be6403,Do tell your sellers to ship products and Jatin helped me alot there was an agent saurabh that person literally told be my order is not eligible for return and Jatin understands my case and advsd the best to me So keep this guy around and do either train others cz their incompitence is causing us issued 
b34b4f54-6603-40aa-a6e5-a0c9ddd595a6,Chat person talking very good 
484c2575-0ca8-48d2-b934-a414ae0fd196,Just make sure if the seller does not have product they should cancel the order immediately
255b1c21-ac61-4fef-89ba-05d600646251,Thank you Shopzilla customer care 
e471242e-e1c8-4a71-8bae-6af6aeefee02,"Its amazing... Way of talking was so cool. No special effort required to teel my problem... Everything was fair i just love the agent and her way to understand,talk ....it was very humble????????"
9bd97212-02af-43d0-9887-e146299d76ff,Customer care executive was polite and knowledgeable 
3848ecb5-58e0-4bef-9911-6d4a79f351f3,Customer support executive are very nice talking way and she raise my issue on a priority basis I'm happy with her services .But not happy with Shopzilla because they will cheat me and I'm prime customer but they will dne fraud with me on my grocery bill so if my issue not resolved I will escalate on Twitter and other social media apps and if my charges are not valid please refund the same .
93bc323b-999e-40d7-beb0-239960f93cf9,Better Experience with executive 
f86baa8f-65d6-4567-bb0d-71eca4e8c2e4,Too awesome customer care supportMind blowing I give 10 star..
6cf25c41-f931-4564-bd43-a205fde31815,Customer support executive simply quoted 24-48 hours. No resolution after 4 days.
91f65aa2-4b80-47d1-bc92-2c60799aeac3,Customer service is very good
92423865-4b17-4554-9de4-985ac210bec5,Well talked to customer support department
85ab221c-9ef9-4e3f-a4c6-102b117fc39f,I am Happy With calling a customer care number 
865cb8be-ddec-4ef4-a884-e92fc9a6ca51,Thanks Shopzilla customer care
4d96a5ee-43c0-47b0-96a8-eb462f746082,Very good service by customer executive.
828f1ac3-f98b-48eb-83fa-4df44cf1368c,Shopzilla customer care thanksful supports
f2daf22d-0094-4635-93d4-7c91b1fccfa7,"Customer service agents do not even try to understand or resolve the issue properly , very rude and not at all helpful"
daebb217-cfcb-407d-9195-dc5c708f8c93,Problem is not resolved due to late complaint but I want improvement in Shopzilla delivery and services thatswhy I contacted customer care.
3a416752-6cc6-463a-8e6a-9da12f067abe,"Executive was very polite and helpful, thank u for helping me and solve my problem, thank u so much "
9da8e697-25e5-4987-8f14-df457d33d35e,nice talking
fea1a820-a32a-404c-8a4e-71ee0eca34da,Understand the customer querry. My refund request cancelled by your executive without giving proper reply. I'm never purchase from Shopzilla again.
9e7e4ba0-f168-4793-b958-1153064a7897,The senior executive disconnected the call after asking me to wait. 
2f3d3970-d871-4f9c-b3c7-a6b47c876445,Nice person
4b010734-f463-478c-9272-7f9f99824e0a,good customer care service
7dcbb2af-5099-4d66-8990-0fe63bfb9034,The delivery person misguided me. He told me that he had to show dents on exchanged phone by Shopzilla order but there was no dents on my exchanged phone. That's why I denied to exchange my phone because he forcefully decreased price of my phone.
03ae2b1d-634e-4543-aef1-d4f0f0ce596d,Resolve the customer Issues well in time so that customer will not suffer so long. I'm facing the issue since 05 months and Shopzilla not issue the refund of my product as order cancelled by Shopzilla Executive.
1340d01e-8424-4050-8066-39f4a1cc1b1b,The issue is yet to be resolved...this is fraud..pl take action against the person concerned.
6126c95f-0abf-4c71-b669-5061e616e09d,Thanks for supportNice to talk with customerThanks for your support
fc8e8a6d-6445-4830-bcde-18c403c28d82,What is the sellers you have that selling poor quality of product making fool of the customers 
8d093faf-8359-494d-9955-224cf8a5de8d,Very genuine person ??????
aefc5b4e-9f37-408b-8294-3e566e01803d,Good service for customer care 
38c4deb2-e3f8-4481-adc0-5d29623df2b4,Wrost experience received from Shopzilla to resolve an issue you people are talking 20days and still your are asking to wait
d77a6021-3c80-4b91-b134-4c906a423b27,No need to improve Shopzilla you are already having the best customer care executive Miss   
54fd1655-e329-45dd-bdbe-28b5bd378583,your customer executive is the worst of all the time. they keep giving   like their website is not working on the data is not showing.
ffac5993-964b-4280-a2a3-feb93225d77f,Very nice agent 
dca70b0d-b21a-4b32-87dd-3479b93ca77d,Very good support by customer executive officer. 
6048141b-b54e-40f6-914b-2e2184baa8ff,Order cancelled by seller this is very wrong thing...about my Motorola mehroon colour mobile 
d0d06e97-557a-4adc-aceb-49176f5a6451,A nothing Shopzilla Because he person in good communicate with me 
6dfc20ee-ab6a-4a1d-a307-773e10319e39,Thanks for my help and it was nice talking to you sir.
649e143f-2592-4da1-be8b-32d72a847935,Post delivery service is very good. Need to improve delivery person minimum knowledge regarding the policies of delivery the products
fb01c81c-a7ea-4d7a-9729-ea1d6a6aa8a4,Excellent customer service 
332d1dea-5cec-43be-ac9d-ade76ae39656,Executive was very supportive at the time of conversation.
61c7095c-d18d-4109-b654-c025cbbcc71c,Executive answered my questions patiently and very clearly
fc2ee7fd-9ab0-4654-a45a-6d0cf2c42c12,Customer executive was extremely patient and resolved the asked concern in a very polite manner 
acd10980-483c-4ae0-b5ba-2b5c54020060,Customer care person is good manners but my problem is not resolved please help
a89a2a48-8314-4dc5-ab49-1acb1f3208ad,The customer care executive was very polite and good. And seemed genuinely concerned for the customers. 5 starts for that ..
74ea95cb-f4fa-4b27-8056-697f1bae1d41,Horrible customer service 
d1485f1a-aaf7-4571-8091-ab0f1fbd4e3d,nice person with good skills
fc2272d3-5223-4220-b27b-8fb2e521f340,Agent comunication skill was very bad and my is not solved and Shopzilla aap show mea issue is solved and customer support cannot understand my situation my product is delivered and Shopzilla soe mea product is delivered I was very upset for customer service and delever service  too much time teken by Shopzilla my patience is losing 
e94367ee-52f3-4460-9ee9-8a7621fe9e3f,Very good way of talking of customer care.
6a08a33b-8f6c-4c74-83f8-c9aad963c785,Coustomer executive so goodThnxx   
f0a004d5-108c-4ae9-9a0f-72fed03afff1,Customer care service boy communication skills excellent.my problem solve but delivery time is long.my request delivery to 11th August.
3e8a4210-3369-4d32-bb0a-442e9d56f2a9,Make sure that sellers deliver the correct product....this was the second time that this has happened... very disheartening 
761b5e34-c21e-47d1-af19-00d0dbe10032,Customer care executive is so helpful..she resolved my problem.thank you so much ??
2b04a606-8f11-4bc7-bcf1-9d6323a66e75,Your executive is not interested for help and she don't know how to talk with customer.. educate her first...such a worst experience ever....my call was disconnected in between that was awesome ???? you people doing wonderful job... keep it up...one day you guys will be the reason of company closure... best of luck...it will not take much time.. only you have to do one thing..hire same executives.. with help you to achieve this goal....
dfb2914d-e3c3-4f21-89eb-5cb6affa93cf,Customer executive response very politely that's why I will be go for a Shopzilla 
fe84db55-12ec-4439-9575-46afe41433d8,Much time consuming to resolve problemBut call executive is good
9108bba8-8c5c-4dc5-a9e4-a8ff9a446447,Shopzilla and seller take too much time to refund please solve it in future 
46387da3-4fa8-4467-aa5c-e7b9cab4ed67,Just Too happy with customer executive that he helps me to return & refunds.
23af1222-99a1-46b6-bdf1-e0abc791b78e,The representative I spoke with was very kind and very informative and resolved my query soon. Please hire more customer support executive like him. Thank you
f04279b7-ca1e-4f15-9d54-f96990d18d42,No help this person
e0481670-ac27-482c-99f8-79897a07838e,Customer care executive is too good
e785c570-c3a6-47d2-b9a5-494eed7a5250,Customer support executive is also good 
99655865-1c4d-400a-887a-1073d8cfbe74,Good customer service 
b529820b-f096-4858-96f2-0430358ff966,Very good person customer care executive and very politely behaviour 
6e8e6c74-4c81-47b7-990e-f90eaa13d125,Your agent not solve the problem and cut the call 
723c4601-1ae0-42ba-9b29-5734938355c9,customer service is very helpful thanks....
465e6d64-7d02-4659-828e-65baa7e2cf26,Good person
701460af-9544-4f91-ad4a-b0049fbe4360,Very good person.
68bec6fc-8123-4ccf-9d18-1eaa8b189406,Very poor customer service on issues handling.
3196c30c-763e-4885-8391-30461536e725,Customer support executive is Nice
d0bcf3aa-9aa6-4fb2-ae88-708bf04f38c7,Wonder full customer service 
4ec22c4e-de16-4769-ad6a-74e65887146a,Good customer service
39d6f04c-0ebf-42f0-a42b-60b880ad8d5b,The executive was very helpful and understood my concern very properly
cfe48ada-5c77-4a59-8ae1-cd5ace40f8b0,Tge customer executive was so supportive 
9bde3c39-458d-46c3-b4c8-50e9f2cc7e87,Executive was not able to tell me the reason why the return request was cancelled. He just simply created another return. Not happy with resolution 
50adb266-f1f3-4cc8-a3cf-7650b0aa2f7a,Talking way what is very good but my issue was not solve
c5ed2a49-eb24-492b-8117-868c8d805854,Very natural communication. I m very happy to your talking skill.
bfd7fa59-f5a1-41fd-bdeb-33268b891e06,Customer support is very good The talk with me is very good
d741a694-d5c2-465c-8053-6ce9bda6f414,Customer executive person was so nice and I am happy to talk with him he has solve my problem 
6d998493-bbd8-4f40-8cf4-3a695cf1e5a9,I am unhappy because my issue is not resolve by Shopzilla custmer support executive and also return department of Shopzilla. 
ad810f3d-0095-4a30-b16b-4c3c6ed22e2c,i am very happt to communicate with your customer care...it is a good conversation
e64005c8-223a-4996-b97d-c28e27d6c9d2,Very good support in your Customer care ??
3fb0fac1-b82f-48b4-bdb2-623ebd3be66d,  talked to me very politely and helped me in solving my issues 
7948c8ca-451b-4da0-98de-529f7fffc470,The seller has disappointed me due to one 1000 rs he want earn from me bull shit ...Like this fellows you loss customers like me tell that LG seller to not behave like this again with anyone
47ce6d00-4b50-48a6-b0ef-1a9b3629c070,"Your executive's are good for nothing. They don't have any information, nor authority, nor knowledge. You are wasting our time and money by hiring such fools. They can only provide information which is already available on app."
b2dfda38-458b-42c0-8c0d-c60b1eca49b9,Customer service is very good
5f2b1f7c-a49b-451a-8d80-8f5d3b9951fe,"Your executive's are good for nothing. They don't have any information, or knowledge or authority. They only read information which is already provided on app. You are wasting our time and hard earned money by hiring such fools. Connect us to person who can actually help us and resolve our issue."
a12aa24a-c65f-4d13-bb63-05b693dddc86,Which i raise my first first complain for the agent that i shall be cancel because that delivery boy is very innocent so don't action against that boy this  is my rquest to u ??
8cd65f33-faa9-44c1-b143-95d5fcf4ca4c,"Himani from senior desk was able to help me with resolution, rest any agent didn't even know what the egift card is and how they work.Good job Himani.Imporve your product knowledge for rest of agents."
ac8b7d57-00f0-4920-a690-1e2e924571b4,The customer service executive with whom  I had a word with was very professional in his work and understanding. He understood the issue I was facing and helped me. 
9f681ad5-29d8-4431-8dba-ac50c3f7074d,Worst customer service 
5c5dcfde-03b1-44e6-b3fa-4e564b9b5489,The customer executive I communicated with was very informative and talented she had resolved the case in just 5 mins which none other executive could resolve it from 7 days.I rate her more than 5.
5c2a8fb9-a7c2-4bcb-abe1-d73d1ea11dd1,Waste service by customer and delivery agent is not responding properly no response from delivery agent 
608d9f54-784f-4f6f-9494-3c29b5954a79,Customer service improve 
78cbd4f3-48a2-45d9-8c55-9fdade15bdaa,"I'm really unhappy with the customer service, my issue is still not resolved. "
04bd5be4-257a-489a-a5a3-45315464e5d4,"Customers care personal are not helpful,"
196d0cbc-8fc3-4101-ad42-fa5ba1ccf8d0,Customer service sapoot very good
1956faec-a011-4063-a286-0a225e112e06,Good talking and full sport 
347f0023-67cc-4095-8206-a964f99f1bb1,The agent was knowledgeable and was very attentive. He resolved my query very quickly. 5 star ? rating and a good appreciation for him. All the best for your future you are working so hard.
629b3538-9c88-4d30-8e71-df0de721a5e3,Support person was super 
d6fe2451-bc33-4d7a-b203-73587bafca14,Executive was calm and professional and helped to resolve my issue. 
11bbf1be-fdca-4b56-945d-ea921bcada5e,Mr   is very nice talking sence
2be04bb0-5d29-4454-ab5f-5c73170ea15e,"Thanks to that support executive..picked up today itself, thanks a lot"
df75fdee-b611-4138-b838-e6395dba4df1,"It's completely seller mistake, thank you Shopzilla for support, one main request, please do support in Other language also"
